user_id,order_id,purchase_ts,purchase_ts_cleaned,purchase_year,purchase_month,time_to_ship,ship_ts,product_name,product_name_cleaned,product_id,usd_price,purchase_platform,marketing_channel,marketing_channel_cleaned,account_creation_method,account_creation_method_cleaned,country_code,date_check,region,revenue
563f3664,fcffccf998a37874,28-02-2021,2021-02-28,2021,2,2,2021-03-02,Dell Gaming Mouse,dell gaming mouse,8d4f, $49.98 ,mobile app,email,email,desktop,desktop,US,TRUE,NA,49.98
5dc182d2,e22f13ed65b40901,28-02-2021,2021-02-28,2021,2,2,2021-03-02,Dell Gaming Mouse,dell gaming mouse,8d4f, $49.98 ,mobile app,direct,direct,desktop,desktop,US,TRUE,NA,49.98
c8611dac,da3d8982ca484718,28-02-2021,2021-02-28,2021,2,2,2021-03-02,JBL Quantum 100 Gaming Headset,jbl quantum 100 gaming headset,8315, $23.78 ,mobile app,email,email,desktop,desktop,HK,TRUE,EMEA,23.78
ee3a8610,cea650a77cf100629,28-02-2021,2021-02-28,2021,2,1,2021-03-01,JBL Quantum 100 Gaming Headset,jbl quantum 100 gaming headset,4c58, $23.98 ,mobile app,direct,direct,desktop,desktop,US,TRUE,NA,23.98
439f68f8,cd78025e15730437,28-02-2021,2021-02-28,2021,2,2,2021-03-02,JBL Quantum 100 Gaming Headset,jbl quantum 100 gaming headset,4db1, $13.98 ,mobile app,email,email,desktop,desktop,US,TRUE,NA,13.98
6adf0f56,fd90aa2aea446089,28-02-2021,2021-02-28,2021,2,3,2021-03-03,27in 4K gaming monitor,27in 4k gaming monitor,e7e6, $480.00 ,website,direct,direct,desktop,desktop,PH,TRUE,APAC,480.0
2ba284b5,f419f9ba0df20651,28-02-2021,2021-02-28,2021,2,1,2021-03-01,Nintendo Switch,nintendo switch,e682, $168.00 ,website,direct,direct,desktop,desktop,CL,TRUE,EMEA,168.0
a288150,f419f9ba0df20651,28-02-2021,2021-02-28,2021,2,1,2021-03-01,Nintendo Switch,nintendo switch,e682, $168.00 ,website,direct,direct,desktop,desktop,CL,TRUE,EMEA,168.0
eaa393cb,f2834cfcefa99132,28-02-2021,2021-02-28,2021,2,3,2021-03-03,Nintendo Switch,nintendo switch,8d0d, $168.00 ,website,direct,direct,desktop,desktop,US,TRUE,NA,168.0
a39898,f2834cfcefa99132,28-02-2021,2021-02-28,2021,2,3,2021-03-03,Nintendo Switch,nintendo switch,8d0d, $168.00 ,website,direct,direct,desktop,desktop,US,TRUE,NA,168.0
fbbe7f96,f1ce5fc7872106314,28-02-2021,2021-02-28,2021,2,1,2021-03-01,Nintendo Switch,nintendo switch,e682, $162.75 ,website,direct,direct,desktop,desktop,RU,TRUE,APAC,162.75
be73293,f1ce5fc7872106314,28-02-2021,2021-02-28,2021,2,1,2021-03-01,Nintendo Switch,nintendo switch,e682, $162.75 ,website,direct,direct,desktop,desktop,RU,TRUE,APAC,162.75
32615aac,e8525e7796423461,28-02-2021,2021-02-28,2021,2,2,2021-03-02,27in 4K gaming monitor,27in 4k gaming monitor,e7e6, $480.00 ,website,email,email,desktop,desktop,US,TRUE,NA,480.0
539ec882,de03cd1003a36857,28-02-2021,2021-02-28,2021,2,3,2021-03-03,Nintendo Switch,nintendo switch,e682, $168.00 ,website,email,email,desktop,desktop,US,TRUE,NA,168.0
a8ba1ad3,d581cf612f771496,28-02-2021,2021-02-28,2021,2,3,2021-03-03,Sony PlayStation 5 Bundle,sony playstation 5 bundle,54ed," $1,530.00 ",website,direct,direct,desktop,desktop,PE,TRUE,LATAM,1530.0
ad42384c,d52489b3eaf73412,28-02-2021,2021-02-28,2021,2,2,2021-03-02,Nintendo Switch,nintendo switch,e682, $164.88 ,website,direct,direct,desktop,desktop,FR,TRUE,EMEA,164.88
7f6993f9,d4128d7cb0854426,28-02-2021,2021-02-28,2021,2,1,2021-03-01,27in 4K gaming monitor,27in 4k gaming monitor,e7e6, $480.00 ,website,direct,direct,desktop,desktop,US,TRUE,NA,480.0
fc145dee,d1dea3b64ee106468,28-02-2021,2021-02-28,2021,2,1,2021-03-01,Nintendo Switch,nintendo switch,e682, $168.00 ,website,direct,direct,desktop,desktop,US,TRUE,NA,168.0
1826929d,d18218dc0ff12836,28-02-2021,2021-02-28,2021,2,2,2021-03-02,Sony PlayStation 5 Bundle,sony playstation 5 bundle,54ed," $1,787.03 ",website,direct,direct,desktop,desktop,CA,TRUE,EMEA,1787.03
6a1c1bbd,ccd07eabf9d45807,28-02-2021,2021-02-28,2021,2,1,2021-03-01,Lenovo IdeaPad Gaming 3,lenovo ideapad gaming 3,04ac," $1,018.30 ",website,direct,direct,desktop,desktop,SA,TRUE,EMEA,1018.3
bf01afe1,cc7b410289a80868,28-02-2021,2021-02-28,2021,2,1,2021-03-01,Nintendo Switch,nintendo switch,e682, $164.64 ,website,direct,direct,desktop,desktop,NO,TRUE,EMEA,164.64
aa32fc51,c7ed57e16b472153,28-02-2021,2021-02-28,2021,2,1,2021-03-01,Nintendo Switch,nintendo switch,8d0d, $162.75 ,website,direct,direct,desktop,desktop,DE,TRUE,EMEA,162.75
c8f1df92,c60ba930d5884969,28-02-2021,2021-02-28,2021,2,3,2021-03-03,Nintendo Switch,nintendo switch,8d0d, $168.00 ,website,direct,direct,desktop,desktop,US,TRUE,NA,168.0
26e89e81,c4c7637ace018754,28-02-2021,2021-02-28,2021,2,3,2021-03-03,JBL Quantum 100 Gaming Headset,jbl quantum 100 gaming headset,ab0f, $24.00 ,website,email,email,desktop,desktop,US,TRUE,NA,24.0
9d3fed19,c1b7e93577a66480,28-02-2021,2021-02-28,2021,2,1,2021-03-01,Nintendo Switch,nintendo switch,e682, $168.00 ,website,direct,direct,desktop,desktop,US,TRUE,NA,168.0
8a694f2a,c12960d584558773,28-02-2021,2021-02-28,2021,2,3,2021-03-03,27in 4K gaming monitor,27in 4k gaming monitor,891b, $451.10 ,website,direct,direct,desktop,desktop,IT,TRUE,EMEA,451.1
734ed6a0,c066c5b329849530,28-02-2021,2021-02-28,2021,2,2,2021-03-02,Nintendo Switch,nintendo switch,e682, $168.00 ,website,direct,direct,desktop,desktop,IS,TRUE,EMEA,168.0
f84e4518,bf34bdc9988104907,28-02-2021,2021-02-28,2021,2,1,2021-03-01,JBL Quantum 100 Gaming Headset,jbl quantum 100 gaming headset,ab0f, $24.00 ,website,direct,direct,desktop,desktop,US,TRUE,NA,24.0
eb40b7ef,beeb56de18199399,28-02-2021,2021-02-28,2021,2,3,2021-03-03,27in 4K gaming monitor,27in 4k gaming monitor,891b, $480.00 ,website,direct,direct,desktop,desktop,US,TRUE,NA,480.0
b75441b0,bd89c379bfd77657,28-02-2021,2021-02-28,2021,2,2,2021-03-02,Nintendo Switch,nintendo switch,e682, $168.00 ,website,direct,direct,desktop,desktop,US,TRUE,NA,168.0
995f7779,bb54f1b5edb64869,28-02-2021,2021-02-28,2021,2,1,2021-03-01,Nintendo Switch,nintendo switch,e682, $105.73 ,website,direct,direct,desktop,desktop,MX,TRUE,LATAM,105.73
8da20e6b,bb0f73f6b5f60150,28-02-2021,2021-02-28,2021,2,2,2021-03-02,Nintendo Switch,nintendo switch,8d0d, $164.69 ,website,direct,direct,desktop,desktop,FR,TRUE,EMEA,164.69
dff31285,f7f9716845694670,27-02-2021,2021-02-27,2021,2,3,2021-03-02,JBL Quantum 100 Gaming Headset,jbl quantum 100 gaming headset,4db1, $13.98 ,mobile app,email,email,desktop,desktop,US,TRUE,NA,13.98
524b4279,efcb85bd57e36312,27-02-2021,2021-02-27,2021,2,1,2021-02-28,JBL Quantum 100 Gaming Headset,jbl quantum 100 gaming headset,4c58, $14.71 ,mobile app,direct,direct,desktop,desktop,CA,TRUE,EMEA,14.71
1c472157,e28b7922d7a14543,27-02-2021,2021-02-27,2021,2,1,2021-02-28,JBL Quantum 100 Gaming Headset,jbl quantum 100 gaming headset,8315, $23.62 ,mobile app,email,email,desktop,desktop,US,TRUE,NA,23.62
39753d16,dd7649f0d2e26249,27-02-2021,2021-02-27,2021,2,2,2021-03-01,JBL Quantum 100 Gaming Headset,jbl quantum 100 gaming headset,4db1, $23.98 ,mobile app,email,email,desktop,desktop,US,TRUE,NA,23.98
811157ea,b8763e65f4055081,27-02-2021,2021-02-27,2021,2,2,2021-03-01,JBL Quantum 100 Gaming Headset,jbl quantum 100 gaming headset,4db1, $13.50 ,mobile app,email,email,desktop,desktop,GB,TRUE,EMEA,13.5
d209a22c,fd433d0794388662,27-02-2021,2021-02-27,2021,2,1,2021-02-28,Nintendo Switch,nintendo switch,8d0d, $168.00 ,website,direct,direct,desktop,desktop,US,TRUE,NA,168.0
09a1410,fd433d0794388662,27-02-2021,2021-02-27,2021,2,1,2021-02-28,Nintendo Switch,nintendo switch,8d0d, $168.00 ,website,direct,direct,desktop,desktop,US,TRUE,NA,168.0
4c49896e,f8e9ab7667433931,27-02-2021,2021-02-27,2021,2,1,2021-02-28,Nintendo Switch,nintendo switch,e682, $168.00 ,website,affiliate,affiliate,unknown,unknown,US,TRUE,NA,168.0
4987723,f8e9ab7667433931,27-02-2021,2021-02-27,2021,2,1,2021-02-28,Nintendo Switch,nintendo switch,e682, $168.00 ,website,affiliate,affiliate,unknown,unknown,US,TRUE,NA,168.0
a8e5ee80,f21ab9355c571571,27-02-2021,2021-02-27,2021,2,2,2021-03-01,Nintendo Switch,nintendo switch,e682, $168.00 ,website,direct,direct,desktop,desktop,EG,TRUE,EMEA,168.0
e5e2134,f21ab9355c571571,27-02-2021,2021-02-27,2021,2,2,2021-03-01,Nintendo Switch,nintendo switch,e682, $168.00 ,website,direct,direct,desktop,desktop,EG,TRUE,EMEA,168.0
4602d34c,e9b718dad5731427,27-02-2021,2021-02-27,2021,2,3,2021-03-02,27in 4K gaming monitor,27in 4k gaming monitor,e7e6, $515.37 ,website,direct,direct,desktop,desktop,GB,TRUE,EMEA,515.37
0ec90fbf,e324d6bfe5a9071,27-02-2021,2021-02-27,2021,2,1,2021-02-28,27in 4K gaming monitor,27in 4k gaming monitor,891b, $439.19 ,website,email,email,desktop,desktop,AT,TRUE,EMEA,439.19
9b92bad0,e1b23d863c765762,27-02-2021,2021-02-27,2021,2,2,2021-03-01,Nintendo Switch,nintendo switch,e682, $147.00 ,website,direct,direct,desktop,desktop,CH,TRUE,EMEA,147.0
5308b03a,d8e788b6cb236609,27-02-2021,2021-02-27,2021,2,1,2021-02-28,Sony PlayStation 5 Bundle,sony playstation 5 bundle,54ed," $2,004.90 ",website,direct,direct,desktop,desktop,FR,TRUE,EMEA,2004.9
bbf2b237,d6eef9c42ae79569,27-02-2021,2021-02-27,2021,2,1,2021-02-28,27in 4K gaming monitor,27in 4k gaming monitor,891b, $456.00 ,website,direct,direct,desktop,desktop,US,TRUE,NA,456.0
e24f0b6b,d4d14b12f3f95611,27-02-2021,2021-02-27,2021,2,2,2021-03-01,Nintendo Switch,nintendo switch,8d0d, $168.00 ,website,direct,direct,desktop,desktop,US,TRUE,NA,168.0
d740d588,ce0c47c916b90928,27-02-2021,2021-02-27,2021,2,2,2021-03-01,27in 4K gaming monitor,27in 4k gaming monitor,891b, $438.14 ,website,direct,direct,desktop,desktop,JP,TRUE,APAC,438.14
2e6e6010,bca9647c51521802,27-02-2021,2021-02-27,2021,2,2,2021-03-01,Lenovo IdeaPad Gaming 3,lenovo ideapad gaming 3,9ef0," $1,143.27 ",website,direct,direct,desktop,desktop,DE,TRUE,EMEA,1143.27
fa92da0c,efb9256f2fd105862,26-02-2021,2021-02-26,2021,2,3,2021-03-01,Dell Gaming Mouse,dell gaming mouse,8d4f, $58.75 ,mobile app,direct,direct,desktop,desktop,ZA,TRUE,EMEA,58.75
cf5beb26,e1dbf48be0d87648,26-02-2021,2021-02-26,2021,2,3,2021-03-01,JBL Quantum 100 Gaming Headset,jbl quantum 100 gaming headset,2997, $24.00 ,mobile app,direct,direct,desktop,desktop,US,TRUE,NA,24.0
36b49078,beb24a9b8c525138,26-02-2021,2021-02-26,2021,2,1,2021-02-27,JBL Quantum 100 Gaming Headset,jbl quantum 100 gaming headset,4c58, $13.98 ,mobile app,direct,direct,desktop,desktop,US,TRUE,NA,13.98
b6122581,be9d728151a77138,26-02-2021,2021-02-26,2021,2,3,2021-03-01,JBL Quantum 100 Gaming Headset,jbl quantum 100 gaming headset,4c58, $19.14 ,mobile app,direct,direct,desktop,desktop,GB,TRUE,EMEA,19.14
37bb2926,b9d3958c57325567,26-02-2021,2021-02-26,2021,2,3,2021-03-01,Dell Gaming Mouse,dell gaming mouse,8d4f, $49.98 ,mobile app,direct,direct,desktop,desktop,US,TRUE,NA,49.98
e161b9dc,b7d5d15a40e95260,26-02-2021,2021-02-26,2021,2,1,2021-02-27,JBL Quantum 100 Gaming Headset,jbl quantum 100 gaming headset,4c58, $13.98 ,mobile app,direct,direct,desktop,desktop,KR,TRUE,APAC,13.98
a4d90bf8,ffd401acdb769775,26-02-2021,2021-02-26,2021,2,1,2021-02-27,JBL Quantum 100 Gaming Headset,jbl quantum 100 gaming headset,ab0f, $24.00 ,website,direct,direct,desktop,desktop,US,TRUE,NA,24.0
8ddfa742,fa99bc480cd60249,26-02-2021,2021-02-26,2021,2,3,2021-03-01,27in 4K gaming monitor,27in 4k gaming monitor,e7e6, $445.79 ,website,email,email,desktop,desktop,NL,TRUE,EMEA,445.79
bc33b204,f2d14b5d31779690,26-02-2021,2021-02-26,2021,2,1,2021-02-27,Nintendo Switch,nintendo switch,8d0d, $162.75 ,website,email,email,desktop,desktop,DE,TRUE,EMEA,162.75
33b1203,f2d14b5d31779690,26-02-2021,2021-02-26,2021,2,1,2021-02-27,Nintendo Switch,nintendo switch,8d0d, $162.75 ,website,email,email,desktop,desktop,DE,TRUE,EMEA,162.75
fffb781c,f2204197256108116,26-02-2021,2021-02-26,2021,2,2,2021-02-28,27in 4K gaming monitor,27in 4k gaming monitor,891b, $480.00 ,website,direct,direct,desktop,desktop,US,TRUE,NA,480.0
17364026,eef626bc178481,26-02-2021,2021-02-26,2021,2,1,2021-02-27,Nintendo Switch,nintendo switch,8d0d, $142.80 ,website,direct,direct,desktop,desktop,US,TRUE,NA,142.8
3645396,eef626bc178481,26-02-2021,2021-02-26,2021,2,1,2021-02-27,Nintendo Switch,nintendo switch,8d0d, $142.80 ,website,direct,direct,desktop,desktop,US,TRUE,NA,142.8
3470052e,e6e09d1bed024249,26-02-2021,2021-02-26,2021,2,3,2021-03-01,JBL Quantum 100 Gaming Headset,jbl quantum 100 gaming headset,ab0f, $23.24 ,website,direct,direct,desktop,desktop,IE,TRUE,EMEA,23.24
96aeafb3,e62e454c43a63814,26-02-2021,2021-02-26,2021,2,2,2021-02-28,Nintendo Switch,nintendo switch,8d0d, $162.75 ,website,direct,direct,desktop,desktop,IE,TRUE,EMEA,162.75
aea7322,e62e454c43a63814,26-02-2021,2021-02-26,2021,2,2,2021-02-28,Nintendo Switch,nintendo switch,8d0d, $162.75 ,website,direct,direct,desktop,desktop,IE,TRUE,EMEA,162.75
f4374e84,e4833793a82103230,26-02-2021,2021-02-26,2021,2,3,2021-03-01,27in 4K gaming monitor,27in 4k gaming monitor,e7e6, $480.00 ,website,direct,direct,desktop,desktop,US,TRUE,NA,480.0
d6de8883,e46bbda2e0790754,26-02-2021,2021-02-26,2021,2,2,2021-02-28,27in 4K gaming monitor,27in 4k gaming monitor,e7e6, $517.58 ,website,direct,direct,desktop,desktop,GB,TRUE,EMEA,517.58
b0376937,e30eb7f59a874687,26-02-2021,2021-02-26,2021,2,3,2021-03-01,Sony PlayStation 5 Bundle,sony playstation 5 bundle,54ed," $1,339.80 ",website,direct,direct,desktop,desktop,US,TRUE,NA,1339.8
c268e1ca,dde4d018cf182297,26-02-2021,2021-02-26,2021,2,1,2021-02-27,27in 4K gaming monitor,27in 4k gaming monitor,e7e6, $480.00 ,website,direct,direct,desktop,desktop,PY,TRUE,LATAM,480.0
6f9345fa,d921e3ca95348102,26-02-2021,2021-02-26,2021,2,2,2021-02-28,Nintendo Switch,nintendo switch,e682, $164.88 ,website,direct,direct,desktop,desktop,NL,TRUE,EMEA,164.88
eaf975b5,d889fd1654099277,26-02-2021,2021-02-26,2021,2,3,2021-03-01,27in 4K gaming monitor,27in 4k gaming monitor,e7e6, $437.95 ,website,direct,direct,desktop,desktop,AU,TRUE,EMEA,437.95
01b90099,d80117872113894,26-02-2021,2021-02-26,2021,2,2,2021-02-28,27in 4K gaming monitor,27in 4k gaming monitor,891b, $386.53 ,website,email,email,desktop,desktop,GB,TRUE,EMEA,386.53
6c98e7bf,d5f07078fa346853,26-02-2021,2021-02-26,2021,2,1,2021-02-27,Nintendo Switch,nintendo switch,e682, $184.90 ,website,direct,direct,desktop,desktop,GB,TRUE,EMEA,184.9
e7a0a728,d53430ba67497836,26-02-2021,2021-02-26,2021,2,3,2021-03-01,Nintendo Switch,nintendo switch,8d0d, $168.00 ,website,direct,direct,desktop,desktop,US,TRUE,NA,168.0
e8ba1abe,ce9f95d065a98295,26-02-2021,2021-02-26,2021,2,2,2021-02-28,Nintendo Switch,nintendo switch,e682, $162.75 ,website,direct,direct,desktop,desktop,NL,TRUE,EMEA,162.75
930ee51f,cc256f83ce062405,26-02-2021,2021-02-26,2021,2,2,2021-02-28,27in 4K gaming monitor,27in 4k gaming monitor,891b, $341.92 ,website,direct,direct,desktop,desktop,US,TRUE,NA,341.92
ee5f1e13,bee70f390ef100700,26-02-2021,2021-02-26,2021,2,1,2021-02-27,Nintendo Switch,nintendo switch,e682, $188.15 ,website,direct,direct,desktop,desktop,GB,TRUE,EMEA,188.15
b01e2f41,bd108f3106374642,26-02-2021,2021-02-26,2021,2,3,2021-03-01,Nintendo Switch,nintendo switch,8d0d, $162.75 ,website,direct,direct,desktop,desktop,FR,TRUE,EMEA,162.75
4b164976,bcd7e16087433380,26-02-2021,2021-02-26,2021,2,3,2021-03-01,27in 4K gaming monitor,27in 4k gaming monitor,e7e6, $480.00 ,website,direct,direct,desktop,desktop,NZ,TRUE,APAC,480.0
3e25e4cc,bcccd2e077928169,26-02-2021,2021-02-26,2021,2,1,2021-02-27,27in 4K gaming monitor,27in 4k gaming monitor,e7e6, $480.00 ,website,direct,direct,desktop,desktop,US,TRUE,NA,480.0
16dba4a5,ba2e62b7d4812306,26-02-2021,2021-02-26,2021,2,1,2021-02-27,JBL Quantum 100 Gaming Headset,jbl quantum 100 gaming headset,ab0f, $23.87 ,website,direct,direct,desktop,desktop,FR,TRUE,EMEA,23.87
b3f859a0,f20ae7eb30676279,25-02-2021,2021-02-25,2021,2,1,2021-02-26,Dell Gaming Mouse,dell gaming mouse,8d4f, $51.71 ,mobile app,direct,direct,desktop,desktop,CA,TRUE,EMEA,51.71
585967a5,ddbd60d596538661,25-02-2021,2021-02-25,2021,2,2,2021-02-27,Dell Gaming Mouse,dell gaming mouse,f81e, $49.98 ,mobile app,email,email,desktop,desktop,US,TRUE,NA,49.98
2620ed4c,dbdcbce934018443,25-02-2021,2021-02-25,2021,2,1,2021-02-26,Nintendo Switch,nintendo switch,8e5d, $166.02 ,mobile app,email,email,desktop,desktop,MN,TRUE,APAC,166.02
93252a62,d9265464be662444,25-02-2021,2021-02-25,2021,2,3,2021-02-28,Dell Gaming Mouse,dell gaming mouse,8d4f, $65.63 ,mobile app,direct,direct,desktop,desktop,GB,TRUE,EMEA,65.63
5b119b3a,cd3d195711639794,25-02-2021,2021-02-25,2021,2,1,2021-02-26,JBL Quantum 100 Gaming Headset,jbl quantum 100 gaming headset,8315, $23.66 ,mobile app,direct,direct,desktop,desktop,US,TRUE,NA,23.66
5000ab2d,c2a01ff4ad035471,25-02-2021,2021-02-25,2021,2,1,2021-02-26,JBL Quantum 100 Gaming Headset,jbl quantum 100 gaming headset,4db1, $13.98 ,mobile app,email,email,desktop,desktop,US,TRUE,NA,13.98
d54d72a2,ffdc99dd71790035,25-02-2021,2021-02-25,2021,2,3,2021-02-28,JBL Quantum 100 Gaming Headset,jbl quantum 100 gaming headset,ab0f, $24.00 ,website,direct,direct,desktop,desktop,US,TRUE,NA,24.0
5513b8bf,fdf4a30178637438,25-02-2021,2021-02-25,2021,2,3,2021-02-28,27in 4K gaming monitor,27in 4k gaming monitor,e7e6, $437.95 ,website,email,email,desktop,desktop,AU,TRUE,EMEA,437.95
609b0a82,fc07b9ccf6242020,25-02-2021,2021-02-25,2021,2,3,2021-02-28,Nintendo Switch,nintendo switch,e682, $168.00 ,website,direct,direct,desktop,desktop,US,TRUE,NA,168.0
9b0664,fc07b9ccf6242020,25-02-2021,2021-02-25,2021,2,3,2021-02-28,Nintendo Switch,nintendo switch,e682, $168.00 ,website,direct,direct,desktop,desktop,US,TRUE,NA,168.0
28a0b59d,fa1546f853a19425,25-02-2021,2021-02-25,2021,2,3,2021-02-28,Lenovo IdeaPad Gaming 3,lenovo ideapad gaming 3,9ef0," $1,198.00 ",website,email,email,desktop,desktop,US,TRUE,NA,1198.0
8a8c0955,f994dd29e7558827,25-02-2021,2021-02-25,2021,2,1,2021-02-26,JBL Quantum 100 Gaming Headset,jbl quantum 100 gaming headset,ab0f, $24.00 ,website,direct,direct,desktop,desktop,KZ,TRUE,EMEA,24.0
00c6f516,f6195d694b23487,25-02-2021,2021-02-25,2021,2,1,2021-02-26,27in 4K gaming monitor,27in 4k gaming monitor,e7e6, $480.00 ,website,email,email,desktop,desktop,US,TRUE,NA,480.0
9bad277c,f5b481bbb3265810,25-02-2021,2021-02-25,2021,2,3,2021-02-28,Nintendo Switch,nintendo switch,8d0d, $168.00 ,website,direct,direct,desktop,desktop,US,TRUE,NA,168.0
ad21201,f5b481bbb3265810,25-02-2021,2021-02-25,2021,2,3,2021-02-28,Nintendo Switch,nintendo switch,8d0d, $168.00 ,website,direct,direct,desktop,desktop,US,TRUE,NA,168.0
dc6784a2,f2e8de6c9ee93149,25-02-2021,2021-02-25,2021,2,2,2021-02-27,Sony PlayStation 5 Bundle,sony playstation 5 bundle,54ed," $1,704.08 ",website,email,email,desktop,desktop,US,TRUE,NA,1704.08
6781308,f2e8de6c9ee93149,25-02-2021,2021-02-25,2021,2,2,2021-02-27,Sony PlayStation 5 Bundle,sony playstation 5 bundle,54ed," $1,704.08 ",website,email,email,desktop,desktop,US,TRUE,NA,1704.08
20c5a2ef,f28b830630316352,25-02-2021,2021-02-25,2021,2,2,2021-02-27,Nintendo Switch,nintendo switch,e682, $168.00 ,website,direct,direct,desktop,desktop,US,TRUE,NA,168.0
c5a425,f28b830630316352,25-02-2021,2021-02-25,2021,2,2,2021-02-27,Nintendo Switch,nintendo switch,e682, $168.00 ,website,direct,direct,desktop,desktop,US,TRUE,NA,168.0
3b7fa8e2,e73554ddfe927104,25-02-2021,2021-02-25,2021,2,1,2021-02-26,Nintendo Switch,nintendo switch,e682, $168.00 ,website,direct,direct,desktop,desktop,US,TRUE,NA,168.0
7fa9785,e73554ddfe927104,25-02-2021,2021-02-25,2021,2,1,2021-02-26,Nintendo Switch,nintendo switch,e682, $168.00 ,website,direct,direct,desktop,desktop,US,TRUE,NA,168.0
ee4b40dd,e4f2373fbcb100655,25-02-2021,2021-02-25,2021,2,1,2021-02-26,Nintendo Switch,nintendo switch,e682, $150.66 ,website,direct,direct,desktop,desktop,RU,TRUE,APAC,150.66
4b47566,e4f2373fbcb100655,25-02-2021,2021-02-25,2021,2,1,2021-02-26,Nintendo Switch,nintendo switch,e682, $150.66 ,website,direct,direct,desktop,desktop,RU,TRUE,APAC,150.66
9e61581b,e46aa115abd66933,25-02-2021,2021-02-25,2021,2,1,2021-02-26,JBL Quantum 100 Gaming Headset,jbl quantum 100 gaming headset,ab0f, $24.00 ,website,direct,direct,desktop,desktop,US,TRUE,NA,24.0
2bd3ebd7,e2450fe289920733,25-02-2021,2021-02-25,2021,2,1,2021-02-26,Nintendo Switch,nintendo switch,e682, $164.69 ,website,email,email,desktop,desktop,FI,TRUE,EMEA,164.69
2a724c1c,e1d5bc0bcab20183,25-02-2021,2021-02-25,2021,2,3,2021-02-28,Nintendo Switch,nintendo switch,8d0d, $168.00 ,website,direct,direct,desktop,desktop,US,TRUE,NA,168.0
49a00598,df51b334d8b32783,25-02-2021,2021-02-25,2021,2,1,2021-02-26,Nintendo Switch,nintendo switch,8d0d, $153.88 ,website,email,email,desktop,desktop,AU,TRUE,EMEA,153.88
635952b8,dc69cd0f58a43024,25-02-2021,2021-02-25,2021,2,3,2021-02-28,Nintendo Switch,nintendo switch,e682, $186.73 ,website,email,email,desktop,desktop,GB,TRUE,EMEA,186.73
0e5011d7,d83e49f19ec8879,25-02-2021,2021-02-25,2021,2,3,2021-02-28,27in 4K gaming monitor,27in 4k gaming monitor,891b, $372.59 ,website,direct,direct,desktop,desktop,GB,TRUE,EMEA,372.59
b7daf9b1,d3cc309880077884,25-02-2021,2021-02-25,2021,2,2,2021-02-27,Nintendo Switch,nintendo switch,8d0d, $168.00 ,website,direct,direct,desktop,desktop,CZ,TRUE,EMEA,168.0
094912df,d2a70c9fe4c6832,25-02-2021,2021-02-25,2021,2,1,2021-02-26,27in 4K gaming monitor,27in 4k gaming monitor,e7e6, $506.46 ,website,direct,direct,desktop,desktop,GB,TRUE,EMEA,506.46
0d435920,d2063aa6e8b8455,25-02-2021,2021-02-25,2021,2,3,2021-02-28,Nintendo Switch,nintendo switch,e682, $153.07 ,website,direct,direct,desktop,desktop,AU,TRUE,EMEA,153.07
be75673c,c9240a1541980626,25-02-2021,2021-02-25,2021,2,1,2021-02-26,Nintendo Switch,nintendo switch,e682, $168.00 ,website,direct,direct,desktop,desktop,BM,TRUE,EMEA,168.0
57d8450c,c790b72f72f38483,25-02-2021,2021-02-25,2021,2,1,2021-02-26,Nintendo Switch,nintendo switch,e682, $188.15 ,website,direct,direct,desktop,desktop,GB,TRUE,EMEA,188.15
67404c5a,c339875c3fb44596,25-02-2021,2021-02-25,2021,2,1,2021-02-26,JBL Quantum 100 Gaming Headset,jbl quantum 100 gaming headset,ab0f, $22.82 ,website,direct,direct,desktop,desktop,JP,TRUE,APAC,22.82
7128ce0b,bd82313366848706,25-02-2021,2021-02-25,2021,2,3,2021-02-28,Nintendo Switch,nintendo switch,e682, $168.00 ,website,direct,direct,desktop,desktop,US,TRUE,NA,168.0
a1e7e6bf,b969b3b398e68482,25-02-2021,2021-02-25,2021,2,1,2021-02-26,27in 4K gaming monitor,27in 4k gaming monitor,e7e6, $451.63 ,website,direct,direct,desktop,desktop,FR,TRUE,EMEA,451.63
481d0169,fbfc0ec3f0332209,24-02-2021,2021-02-24,2021,2,3,2021-02-27,Dell Gaming Mouse,dell gaming mouse,8d4f, $49.98 ,mobile app,direct,direct,desktop,desktop,US,TRUE,NA,49.98
690108de,ec1196ab94d45317,24-02-2021,2021-02-24,2021,2,2,2021-02-26,Dell Gaming Mouse,dell gaming mouse,f81e, $64.05 ,mobile app,email,email,desktop,desktop,GB,TRUE,EMEA,64.05
2e52288b,e2f459dfe1621757,24-02-2021,2021-02-24,2021,2,3,2021-02-27,Dell Gaming Mouse,dell gaming mouse,8d4f, $49.98 ,mobile app,email,email,desktop,desktop,US,TRUE,NA,49.98
414fb66a,e22c184da4e29511,24-02-2021,2021-02-24,2021,2,3,2021-02-27,JBL Quantum 100 Gaming Headset,jbl quantum 100 gaming headset,4db1, $13.98 ,mobile app,email,email,desktop,desktop,US,TRUE,NA,13.98
dc80d553,d5e1f0b308393181,24-02-2021,2021-02-24,2021,2,3,2021-02-27,JBL Quantum 100 Gaming Headset,jbl quantum 100 gaming headset,4db1, $13.98 ,mobile app,email,email,desktop,desktop,US,TRUE,NA,13.98
641ac2c8,bd61fd4f5b143343,24-02-2021,2021-02-24,2021,2,1,2021-02-25,JBL Quantum 100 Gaming Headset,jbl quantum 100 gaming headset,4db1, $13.98 ,mobile app,email,email,desktop,desktop,US,TRUE,NA,13.98
f3b2fcd7,ba4ed6c0597103017,24-02-2021,2021-02-24,2021,2,1,2021-02-25,JBL Quantum 100 Gaming Headset,jbl quantum 100 gaming headset,4c58, $16.49 ,mobile app,direct,direct,desktop,desktop,DE,TRUE,EMEA,16.49
8ea2e61d,b89558cba6d60570,24-02-2021,2021-02-24,2021,2,1,2021-02-25,JBL Quantum 100 Gaming Headset,jbl quantum 100 gaming headset,4db1, $13.98 ,mobile app,email,email,desktop,desktop,US,TRUE,NA,13.98
c198c42b,f9d1716432881950,24-02-2021,2021-02-24,2021,2,3,2021-02-27,JBL Quantum 100 Gaming Headset,jbl quantum 100 gaming headset,ab0f, $20.15 ,website,direct,direct,desktop,desktop,CA,TRUE,EMEA,20.15
779a1118,f82546fbac851208,24-02-2021,2021-02-24,2021,2,2,2021-02-26,Nintendo Switch,nintendo switch,e682, $168.00 ,website,direct,direct,desktop,desktop,US,TRUE,NA,168.0
9a19697,f82546fbac851208,24-02-2021,2021-02-24,2021,2,2,2021-02-26,Nintendo Switch,nintendo switch,e682, $168.00 ,website,direct,direct,desktop,desktop,US,TRUE,NA,168.0
de347998,f609e8f9e4293909,24-02-2021,2021-02-24,2021,2,2,2021-02-26,Nintendo Switch,nintendo switch,8d0d, $204.43 ,website,direct,direct,desktop,desktop,IL,TRUE,EMEA,204.43
347620,f609e8f9e4293909,24-02-2021,2021-02-24,2021,2,2,2021-02-26,Nintendo Switch,nintendo switch,8d0d, $204.43 ,website,direct,direct,desktop,desktop,IL,TRUE,EMEA,204.43
5435ba17,ec05ae9d84737090,24-02-2021,2021-02-24,2021,2,2,2021-02-26,Nintendo Switch,nintendo switch,e682, $168.00 ,website,direct,direct,desktop,desktop,US,TRUE,NA,168.0
35b6663,ec05ae9d84737090,24-02-2021,2021-02-24,2021,2,2,2021-02-26,Nintendo Switch,nintendo switch,e682, $168.00 ,website,direct,direct,desktop,desktop,US,TRUE,NA,168.0
ac79777b,ebf67b1104273075,24-02-2021,2021-02-24,2021,2,3,2021-02-27,Nintendo Switch,nintendo switch,e682, $168.00 ,website,direct,direct,desktop,desktop,US,TRUE,NA,168.0
7974457,ebf67b1104273075,24-02-2021,2021-02-24,2021,2,3,2021-02-27,Nintendo Switch,nintendo switch,e682, $168.00 ,website,direct,direct,desktop,desktop,US,TRUE,NA,168.0
f957ee90,e682e793d79105330,24-02-2021,2021-02-24,2021,2,3,2021-02-27,Nintendo Switch,nintendo switch,e682, $168.00 ,website,affiliate,affiliate,unknown,unknown,US,TRUE,NA,168.0
57e390,e682e793d79105330,24-02-2021,2021-02-24,2021,2,3,2021-02-27,Nintendo Switch,nintendo switch,e682, $168.00 ,website,affiliate,affiliate,unknown,unknown,US,TRUE,NA,168.0
84f49a8e,dd8f092287356572,24-02-2021,2021-02-24,2021,2,2,2021-02-26,27in 4K gaming monitor,27in 4k gaming monitor,e7e6, $480.00 ,website,email,email,desktop,desktop,US,TRUE,NA,480.0
a2832b62,da7cfea6b5068732,24-02-2021,2021-02-24,2021,2,1,2021-02-25,Nintendo Switch,nintendo switch,e682, $168.00 ,website,direct,direct,desktop,desktop,US,TRUE,NA,168.0
68bcec3f,da2f9943e3345213,24-02-2021,2021-02-24,2021,2,1,2021-02-25,Nintendo Switch,nintendo switch,e682, $165.49 ,website,direct,direct,desktop,desktop,SE,TRUE,EMEA,165.49
985fcc38,d597575d7dc64478,24-02-2021,2021-02-24,2021,2,2,2021-02-26,JBL Quantum 100 Gaming Headset,jbl quantum 100 gaming headset,ab0f, $23.59 ,website,direct,direct,desktop,desktop,ES,TRUE,EMEA,23.59
889fca5a,d53deb6304258018,24-02-2021,2021-02-24,2021,2,2,2021-02-26,Sony PlayStation 5 Bundle,sony playstation 5 bundle,54ed," $1,800.00 ",website,direct,direct,desktop,desktop,US,TRUE,NA,1800.0
17f42fad,d48aff514a712735,24-02-2021,2021-02-24,2021,2,1,2021-02-25,Nintendo Switch,nintendo switch,e682, $159.73 ,website,email,email,desktop,desktop,JP,TRUE,APAC,159.73
a1235276,d3ad80e175868154,24-02-2021,2021-02-24,2021,2,2,2021-02-26,Nintendo Switch,nintendo switch,e682, $188.96 ,website,email,email,desktop,desktop,GB,TRUE,EMEA,188.96
0ec0018e,d11f547dcf19057,24-02-2021,2021-02-24,2021,2,2,2021-02-26,27in 4K gaming monitor,27in 4k gaming monitor,891b, $480.00 ,website,direct,direct,desktop,desktop,US,TRUE,NA,480.0
b1a336e5,cf2ebe9b62675295,24-02-2021,2021-02-24,2021,2,2,2021-02-26,Nintendo Switch,nintendo switch,e682, $162.75 ,website,affiliate,affiliate,unknown,unknown,FR,TRUE,EMEA,162.75
7c70390d,ccf219cad2053188,24-02-2021,2021-02-24,2021,2,1,2021-02-25,Nintendo Switch,nintendo switch,8d0d, $188.96 ,website,direct,direct,desktop,desktop,GB,TRUE,EMEA,188.96
8e9941ef,c79266acbcb60555,24-02-2021,2021-02-24,2021,2,3,2021-02-27,Sony PlayStation 5 Bundle,sony playstation 5 bundle,54ed," $1,800.00 ",website,direct,direct,desktop,desktop,US,TRUE,NA,1800.0
38ac4569,c5a43be689825952,24-02-2021,2021-02-24,2021,2,3,2021-02-27,Nintendo Switch,nintendo switch,e682, $160.34 ,website,direct,direct,desktop,desktop,BE,TRUE,EMEA,160.34
85264062,bfa49bdebb82257,24-02-2021,2021-02-24,2021,2,2,2021-02-26,Nintendo Switch,nintendo switch,e682, $184.90 ,website,direct,direct,desktop,desktop,GB,TRUE,EMEA,184.9
3ca8430a,bb48ca20fb527585,24-02-2021,2021-02-24,2021,2,2,2021-02-26,27in 4K gaming monitor,27in 4k gaming monitor,e7e6, $480.00 ,website,email,email,desktop,desktop,US,TRUE,NA,480.0
681114cc,b696ee4af9944920,24-02-2021,2021-02-24,2021,2,3,2021-02-27,Nintendo Switch,nintendo switch,8d0d, $134.40 ,website,direct,direct,desktop,desktop,US,TRUE,NA,134.4
248b42cd,f942fbf77b717763,23-02-2021,2021-02-23,2021,2,1,2021-02-24,JBL Quantum 100 Gaming Headset,jbl quantum 100 gaming headset,4db1, $24.79 ,mobile app,email,email,desktop,desktop,CA,TRUE,EMEA,24.79
14af1903,f5f80c4c4f511462,23-02-2021,2021-02-23,2021,2,2,2021-02-25,JBL Quantum 100 Gaming Headset,jbl quantum 100 gaming headset,4c58, $13.98 ,mobile app,direct,direct,desktop,desktop,US,TRUE,NA,13.98
6d7bc337,bc4d1d8335247261,23-02-2021,2021-02-23,2021,2,2,2021-02-25,Dell Gaming Mouse,dell gaming mouse,f81e, $49.98 ,mobile app,email,email,desktop,desktop,AR,TRUE,EMEA,49.98
e69c1f1e,fede5c24b0797422,23-02-2021,2021-02-23,2021,2,2,2021-02-25,Nintendo Switch,nintendo switch,8d0d, $142.80 ,website,direct,direct,desktop,desktop,US,TRUE,NA,142.8
9c12903,fede5c24b0797422,23-02-2021,2021-02-23,2021,2,2,2021-02-25,Nintendo Switch,nintendo switch,8d0d, $142.80 ,website,direct,direct,desktop,desktop,US,TRUE,NA,142.8
c524af42,fe4c3daa5a083419,23-02-2021,2021-02-23,2021,2,1,2021-02-24,Nintendo Switch,nintendo switch,e682, $164.69 ,website,email,email,desktop,desktop,PT,TRUE,EMEA,164.69
24a6470,fe4c3daa5a083419,23-02-2021,2021-02-23,2021,2,1,2021-02-24,Nintendo Switch,nintendo switch,e682, $164.69 ,website,email,email,desktop,desktop,PT,TRUE,EMEA,164.69
ee3bfddf,f9c97c4485b100633,23-02-2021,2021-02-23,2021,2,3,2021-02-26,27in 4K gaming monitor,27in 4k gaming monitor,891b, $328.56 ,website,direct,direct,desktop,desktop,US,TRUE,NA,328.56
6.071E+72,f06bb734f6f3001,23-02-2021,2021-02-23,2021,2,1,2021-02-24,27in 4K gaming monitor,27in 4k gaming monitor,e7e6, $444.04 ,website,direct,direct,desktop,desktop,KR,TRUE,APAC,444.04
2f894406,e3580653bc822319,23-02-2021,2021-02-23,2021,2,3,2021-02-26,Nintendo Switch,nintendo switch,e682, $160.34 ,website,email,email,desktop,desktop,PT,TRUE,EMEA,160.34
85f9582c,df9b2b1be9a56999,23-02-2021,2021-02-23,2021,2,1,2021-02-24,Nintendo Switch,nintendo switch,e682, $168.00 ,website,direct,direct,desktop,desktop,US,TRUE,NA,168.0
7d2b8244,dc994458da253454,23-02-2021,2021-02-23,2021,2,2,2021-02-25,27in 4K gaming monitor,27in 4k gaming monitor,891b, $480.00 ,website,direct,direct,desktop,desktop,US,TRUE,NA,480.0
9f02215f,d9c6d57062f67221,23-02-2021,2021-02-23,2021,2,1,2021-02-24,Nintendo Switch,nintendo switch,e682, $157.95 ,website,direct,direct,desktop,desktop,CA,TRUE,EMEA,157.95
9ec17d39,d9c2f5bb85067103,23-02-2021,2021-02-23,2021,2,2,2021-02-25,Nintendo Switch,nintendo switch,8d0d, $168.00 ,website,direct,direct,desktop,desktop,US,TRUE,NA,168.0
b8f3b345,d73d02cab3678352,23-02-2021,2021-02-23,2021,2,3,2021-02-26,27in 4K gaming monitor,27in 4k gaming monitor,891b, $480.00 ,website,direct,direct,desktop,desktop,BR,TRUE,EMEA,480.0
78b81a64,d3d8a23770e51627,23-02-2021,2021-02-23,2021,2,3,2021-02-26,Nintendo Switch,nintendo switch,e682, $146.84 ,website,direct,direct,desktop,desktop,RU,TRUE,APAC,146.84
21c877ed,d3629276abb16732,23-02-2021,2021-02-23,2021,2,3,2021-02-26,27in 4K gaming monitor,27in 4k gaming monitor,891b, $445.79 ,website,direct,direct,desktop,desktop,DE,TRUE,EMEA,445.79
3058d026,d035d463edc22646,23-02-2021,2021-02-23,2021,2,3,2021-02-26,27in 4K gaming monitor,27in 4k gaming monitor,891b, $328.10 ,website,direct,direct,desktop,desktop,US,TRUE,NA,328.1
c6127b4e,cb526615a0683805,23-02-2021,2021-02-23,2021,2,2,2021-02-25,Nintendo Switch,nintendo switch,e682, $168.00 ,website,direct,direct,desktop,desktop,US,TRUE,NA,168.0
63e24213,c633729a4d743265,23-02-2021,2021-02-23,2021,2,2,2021-02-25,27in 4K gaming monitor,27in 4k gaming monitor,891b, $408.00 ,website,direct,direct,desktop,desktop,CZ,TRUE,EMEA,408.0
cf332efb,c47185b209887577,23-02-2021,2021-02-23,2021,2,3,2021-02-26,27in 4K gaming monitor,27in 4k gaming monitor,891b, $451.10 ,website,direct,direct,desktop,desktop,FI,TRUE,EMEA,451.1
04ef7c1a,c21c6e6eded5140,23-02-2021,2021-02-23,2021,2,2,2021-02-25,27in 4K gaming monitor,27in 4k gaming monitor,891b, $329.96 ,website,direct,direct,desktop,desktop,US,TRUE,NA,329.96
bd2be489,bdbff66129380073,23-02-2021,2021-02-23,2021,2,2,2021-02-25,Nintendo Switch,nintendo switch,e682, $158.32 ,website,social media,social media,tablet,tablet,CA,TRUE,EMEA,158.32
cb1d3375,bcd88c74fc885864,23-02-2021,2021-02-23,2021,2,3,2021-02-26,Nintendo Switch,nintendo switch,e682, $168.00 ,website,direct,direct,desktop,desktop,US,TRUE,NA,168.0
14b5142d,bc322b3342811471,23-02-2021,2021-02-23,2021,2,2,2021-02-25,Nintendo Switch,nintendo switch,e682, $184.90 ,website,direct,direct,desktop,desktop,GB,TRUE,EMEA,184.9
a5856f4c,ba94ed77fdc70122,23-02-2021,2021-02-23,2021,2,2,2021-02-25,27in 4K gaming monitor,27in 4k gaming monitor,e7e6, $450.62 ,website,unknown,unknown,unknown,unknown,JP,TRUE,APAC,450.62
e0275fa3,fc8be55a24894787,22-02-2021,2021-02-22,2021,2,1,2021-02-23,Dell Gaming Mouse,dell gaming mouse,f81e, $54.01 ,mobile app,email,email,desktop,desktop,AU,TRUE,EMEA,54.01
87415b00,f4a0ac0fe1757512,22-02-2021,2021-02-22,2021,2,2,2021-02-24,Dell Gaming Mouse,dell gaming mouse,8d4f, $49.98 ,mobile app,direct,direct,desktop,desktop,US,TRUE,NA,49.98
b74895a6,f412cd2178077642,22-02-2021,2021-02-22,2021,2,1,2021-02-23,Dell Gaming Mouse,dell gaming mouse,8d4f, $49.98 ,mobile app,direct,direct,desktop,desktop,US,TRUE,NA,49.98
e2645216,eee229f304495641,22-02-2021,2021-02-22,2021,2,2,2021-02-24,Dell Gaming Mouse,dell gaming mouse,8d4f, $49.98 ,mobile app,direct,direct,desktop,desktop,US,TRUE,NA,49.98
d5cd6f61,ec99727aae090297,22-02-2021,2021-02-22,2021,2,2,2021-02-24,JBL Quantum 100 Gaming Headset,jbl quantum 100 gaming headset,4db1, $13.61 ,mobile app,email,email,desktop,desktop,GB,TRUE,EMEA,13.61
594dd17d,d9e105ff6c139052,22-02-2021,2021-02-22,2021,2,3,2021-02-25,JBL Quantum 100 Gaming Headset,jbl quantum 100 gaming headset,4c58, $14.88 ,mobile app,direct,direct,desktop,desktop,CA,TRUE,EMEA,14.88
e6288130,d3e8c5cb81b97228,22-02-2021,2021-02-22,2021,2,3,2021-02-25,Dell Gaming Mouse,dell gaming mouse,8d4f, $49.98 ,mobile app,direct,direct,desktop,desktop,US,TRUE,NA,49.98
235ed1cc,ff785f0be0e17292,22-02-2021,2021-02-22,2021,2,1,2021-02-23,Lenovo IdeaPad Gaming 3,lenovo ideapad gaming 3,9ef0," $1,143.27 ",website,direct,direct,desktop,desktop,FR,TRUE,EMEA,1143.27
46b0af81,fecc9d6766231653,22-02-2021,2021-02-22,2021,2,3,2021-02-25,Nintendo Switch,nintendo switch,8d0d, $184.90 ,website,direct,direct,desktop,desktop,GB,TRUE,EMEA,184.9
b0a2896,fecc9d6766231653,22-02-2021,2021-02-22,2021,2,3,2021-02-25,Nintendo Switch,nintendo switch,8d0d, $184.90 ,website,direct,direct,desktop,desktop,GB,TRUE,EMEA,184.9
865c2c8e,fa72e73027557142,22-02-2021,2021-02-22,2021,2,3,2021-02-25,27in 4K gaming monitor,27in 4k gaming monitor,e7e6, $480.00 ,website,email,email,desktop,desktop,US,TRUE,NA,480.0
3a9106e7,f2c837f2c7926688,22-02-2021,2021-02-22,2021,2,3,2021-02-25,Nintendo Switch,nintendo switch,e682, $164.76 ,website,direct,direct,desktop,desktop,NO,TRUE,EMEA,164.76
9108352,f2c837f2c7926688,22-02-2021,2021-02-22,2021,2,3,2021-02-25,Nintendo Switch,nintendo switch,e682, $164.76 ,website,direct,direct,desktop,desktop,NO,TRUE,EMEA,164.76
3ba4abaa,ef7f17e39e227163,22-02-2021,2021-02-22,2021,2,2,2021-02-24,27in 4K gaming monitor,27in 4k gaming monitor,e7e6, $480.00 ,website,email,email,desktop,desktop,US,TRUE,NA,480.0
e16b37b8,e4b4a98026e95278,22-02-2021,2021-02-22,2021,2,1,2021-02-23,27in 4K gaming monitor,27in 4k gaming monitor,e7e6, $451.10 ,website,direct,direct,desktop,desktop,LU,TRUE,EMEA,451.1
24d586c5,e3e71243ab217886,22-02-2021,2021-02-22,2021,2,1,2021-02-23,Nintendo Switch,nintendo switch,8d0d, $184.90 ,website,direct,direct,desktop,desktop,GB,TRUE,EMEA,184.9
1721c17c,e19e3c08bc612414,22-02-2021,2021-02-22,2021,2,1,2021-02-23,Nintendo Switch,nintendo switch,e682, $164.69 ,website,direct,direct,desktop,desktop,DE,TRUE,EMEA,164.69
8eb3d4e6,e16975a246460589,22-02-2021,2021-02-22,2021,2,2,2021-02-24,JBL Quantum 100 Gaming Headset,jbl quantum 100 gaming headset,ab0f, $21.94 ,website,direct,direct,desktop,desktop,KR,TRUE,APAC,21.94
10f2302a,e090b0bed839974,22-02-2021,2021-02-22,2021,2,3,2021-02-25,Nintendo Switch,nintendo switch,8d0d, $164.69 ,website,direct,direct,desktop,desktop,IE,TRUE,EMEA,164.69
71ae7f18,dcee648460a48863,22-02-2021,2021-02-22,2021,2,2,2021-02-24,JBL Quantum 100 Gaming Headset,jbl quantum 100 gaming headset,ab0f, $21.91 ,website,direct,direct,desktop,desktop,NO,TRUE,EMEA,21.91
9f5870f5,dbfe8316f5f67374,22-02-2021,2021-02-22,2021,2,3,2021-02-25,Nintendo Switch,nintendo switch,e682, $158.32 ,website,social media,social media,tablet,tablet,CA,TRUE,EMEA,158.32
aeef8258,db09258530b74139,22-02-2021,2021-02-22,2021,2,1,2021-02-23,27in 4K gaming monitor,27in 4k gaming monitor,891b, $435.09 ,website,direct,direct,desktop,desktop,GB,TRUE,EMEA,435.09
3ecc8a04,d1000f48f0028462,22-02-2021,2021-02-22,2021,2,2,2021-02-24,Nintendo Switch,nintendo switch,e682, $168.00 ,website,direct,direct,desktop,desktop,US,TRUE,NA,168.0
46104e0b,ccb4829054631447,22-02-2021,2021-02-22,2021,2,1,2021-02-23,27in 4K gaming monitor,27in 4k gaming monitor,891b, $312.00 ,website,email,email,desktop,desktop,SA,TRUE,EMEA,312.0
7e62e1cc,c99901c1d8853987,22-02-2021,2021-02-22,2021,2,2,2021-02-24,Nintendo Switch,nintendo switch,e682, $168.00 ,website,direct,direct,desktop,desktop,US,TRUE,NA,168.0
6703d8ec,c2477af58ab44500,22-02-2021,2021-02-22,2021,2,2,2021-02-24,Lenovo IdeaPad Gaming 3,lenovo ideapad gaming 3,9ef0," $1,198.00 ",website,email,email,desktop,desktop,TH,TRUE,APAC,1198.0
6.109E+24,c1dd7effbeb2842,22-02-2021,2021-02-22,2021,2,1,2021-02-23,27in 4K gaming monitor,27in 4k gaming monitor,e7e6, $480.00 ,website,email,email,desktop,desktop,US,TRUE,NA,480.0
f8375d41,bf5b3c4432e104856,22-02-2021,2021-02-22,2021,2,3,2021-02-25,Nintendo Switch,nintendo switch,e682, $168.00 ,website,direct,direct,desktop,desktop,US,TRUE,NA,168.0
3f6e67c4,f763e27821128748,21-02-2021,2021-02-21,2021,2,2,2021-02-23,JBL Quantum 100 Gaming Headset,jbl quantum 100 gaming headset,4db1, $13.81 ,mobile app,direct,direct,desktop,desktop,AU,TRUE,EMEA,13.81
550bb397,f38bb24531037431,21-02-2021,2021-02-21,2021,2,3,2021-02-24,Nintendo Switch,nintendo switch,8e5d, $165.96 ,mobile app,email,email,desktop,desktop,US,TRUE,NA,165.96
0bb2185,f38bb24531037431,21-02-2021,2021-02-21,2021,2,3,2021-02-24,Nintendo Switch,nintendo switch,8e5d, $165.96 ,mobile app,email,email,desktop,desktop,US,TRUE,NA,165.96
6e8dece1,e2901c796b247695,21-02-2021,2021-02-21,2021,2,3,2021-02-24,Dell Gaming Mouse,dell gaming mouse,8d4f, $47.53 ,mobile app,direct,direct,desktop,desktop,MX,TRUE,LATAM,47.53
a41944fc,c1b7806d65c69433,21-02-2021,2021-02-21,2021,2,1,2021-02-22,JBL Quantum 100 Gaming Headset,jbl quantum 100 gaming headset,8315, $23.54 ,mobile app,email,email,desktop,desktop,US,TRUE,NA,23.54
ba692048,bd093a7900f78983,21-02-2021,2021-02-21,2021,2,2,2021-02-23,Dell Gaming Mouse,dell gaming mouse,8d4f, $49.98 ,mobile app,direct,direct,desktop,desktop,US,TRUE,NA,49.98
c4eb31b0,ffd7c97627783336,21-02-2021,2021-02-21,2021,2,1,2021-02-22,JBL Quantum 100 Gaming Headset,jbl quantum 100 gaming headset,ab0f, $24.00 ,website,direct,direct,desktop,desktop,US,TRUE,NA,24.0
bf7a3f8a,fdf4367a8b981066,21-02-2021,2021-02-21,2021,2,3,2021-02-24,Lenovo IdeaPad Gaming 3,lenovo ideapad gaming 3,9ef0," $1,198.00 ",website,email,email,desktop,desktop,AR,TRUE,EMEA,1198.0
bfa9e3bf,fcb7fb4f0fa81154,21-02-2021,2021-02-21,2021,2,2,2021-02-23,Sony PlayStation 5 Bundle,sony playstation 5 bundle,54ed," $2,004.90 ",website,direct,direct,desktop,desktop,NL,TRUE,EMEA,2004.9
a9e8381,fcb7fb4f0fa81154,21-02-2021,2021-02-21,2021,2,2,2021-02-23,Sony PlayStation 5 Bundle,sony playstation 5 bundle,54ed," $2,004.90 ",website,direct,direct,desktop,desktop,NL,TRUE,EMEA,2004.9
01e31729,fa0867509e13974,21-02-2021,2021-02-21,2021,2,1,2021-02-22,Sony PlayStation 5 Bundle,sony playstation 5 bundle,54ed," $1,800.00 ",website,direct,direct,desktop,desktop,US,TRUE,NA,1800.0
e317701,fa0867509e13974,21-02-2021,2021-02-21,2021,2,1,2021-02-22,Sony PlayStation 5 Bundle,sony playstation 5 bundle,54ed," $1,800.00 ",website,direct,direct,desktop,desktop,US,TRUE,NA,1800.0
ab06db7f,f03eae9ea4272521,21-02-2021,2021-02-21,2021,2,1,2021-02-22,Nintendo Switch,nintendo switch,e682, $168.00 ,website,direct,direct,desktop,desktop,KE,TRUE,EMEA,168.0
06d8622,f03eae9ea4272521,21-02-2021,2021-02-21,2021,2,1,2021-02-22,Nintendo Switch,nintendo switch,e682, $168.00 ,website,direct,direct,desktop,desktop,KE,TRUE,EMEA,168.0
bec7d531,de74f59907580773,21-02-2021,2021-02-21,2021,2,1,2021-02-22,27in 4K gaming monitor,27in 4k gaming monitor,e7e6, $480.00 ,website,email,email,desktop,desktop,CR,TRUE,EMEA,480.0
411dbffe,db74fab06d429434,21-02-2021,2021-02-21,2021,2,3,2021-02-24,27in 4K gaming monitor,27in 4k gaming monitor,891b, $328.18 ,website,direct,direct,desktop,desktop,AD,TRUE,EMEA,328.18
cab05d70,d34bc7e98b385680,21-02-2021,2021-02-21,2021,2,3,2021-02-24,JBL Quantum 100 Gaming Headset,jbl quantum 100 gaming headset,ab0f, $18.19 ,website,email,email,desktop,desktop,AU,TRUE,EMEA,18.19
ce717720,d33bc72732d87221,21-02-2021,2021-02-21,2021,2,3,2021-02-24,JBL Quantum 100 Gaming Headset,jbl quantum 100 gaming headset,ab0f, $27.38 ,website,direct,direct,desktop,desktop,GB,TRUE,EMEA,27.38
247a7b7f,d153d45626817729,21-02-2021,2021-02-21,2021,2,2,2021-02-23,Nintendo Switch,nintendo switch,e682, $168.00 ,website,direct,direct,desktop,desktop,US,TRUE,NA,168.0
454c4510,d05df0e558231114,21-02-2021,2021-02-21,2021,2,3,2021-02-24,Nintendo Switch,nintendo switch,e682, $168.00 ,website,direct,direct,desktop,desktop,US,TRUE,NA,168.0
d7171cab,ca73ce9ccd190864,21-02-2021,2021-02-21,2021,2,1,2021-02-22,27in 4K gaming monitor,27in 4k gaming monitor,e7e6, $480.00 ,website,direct,direct,desktop,desktop,US,TRUE,NA,480.0
0b96f368,c505ef91bf27756,21-02-2021,2021-02-21,2021,2,3,2021-02-24,JBL Quantum 100 Gaming Headset,jbl quantum 100 gaming headset,ab0f, $27.27 ,website,direct,direct,desktop,desktop,GB,TRUE,EMEA,27.27
1123130d,c379d35fed310052,21-02-2021,2021-02-21,2021,2,2,2021-02-23,Lenovo IdeaPad Gaming 3,lenovo ideapad gaming 3,9ef0," $1,198.00 ",website,direct,direct,desktop,desktop,NG,TRUE,EMEA,1198.0
b85179e4,bd9403d2a7c78083,21-02-2021,2021-02-21,2021,2,1,2021-02-22,Nintendo Switch,nintendo switch,e682, $168.00 ,website,direct,direct,desktop,desktop,US,TRUE,NA,168.0
aff6221b,bb05729576974570,21-02-2021,2021-02-21,2021,2,2,2021-02-23,Nintendo Switch,nintendo switch,e682, $164.69 ,website,direct,direct,desktop,desktop,DE,TRUE,EMEA,164.69
40d1fbc9,b661b6ca0d329316,21-02-2021,2021-02-21,2021,2,2,2021-02-23,Nintendo Switch,nintendo switch,8d0d, $168.00 ,website,direct,direct,desktop,desktop,BR,TRUE,EMEA,168.0
0a7ba7b4,fc3581b1d457301,20-02-2021,2021-02-20,2021,2,3,2021-02-23,JBL Quantum 100 Gaming Headset,jbl quantum 100 gaming headset,4c58, $13.98 ,mobile app,direct,direct,desktop,desktop,US,TRUE,NA,13.98
819fc038,f89081694d955287,20-02-2021,2021-02-20,2021,2,3,2021-02-23,Dell Gaming Mouse,dell gaming mouse,8d4f, $49.98 ,mobile app,direct,direct,desktop,desktop,US,TRUE,NA,49.98
08c63312,f59b646f2376610,20-02-2021,2021-02-20,2021,2,1,2021-02-21,JBL Quantum 100 Gaming Headset,jbl quantum 100 gaming headset,4db1, $13.98 ,mobile app,email,email,desktop,desktop,US,TRUE,NA,13.98
9a567ce9,ebf86737d2165253,20-02-2021,2021-02-20,2021,2,2,2021-02-22,Nintendo Switch,nintendo switch,b5f7, $167.98 ,mobile app,email,email,desktop,desktop,US,TRUE,NA,167.98
5674675,ebf86737d2165253,20-02-2021,2021-02-20,2021,2,2,2021-02-22,Nintendo Switch,nintendo switch,b5f7, $167.98 ,mobile app,email,email,desktop,desktop,US,TRUE,NA,167.98
89656dfd,e5a74e009ba58327,20-02-2021,2021-02-20,2021,2,2,2021-02-22,JBL Quantum 100 Gaming Headset,jbl quantum 100 gaming headset,4c58, $13.98 ,mobile app,direct,direct,desktop,desktop,US,TRUE,NA,13.98
13a20ec7,dc44ba49d6111014,20-02-2021,2021-02-20,2021,2,1,2021-02-21,JBL Quantum 100 Gaming Headset,jbl quantum 100 gaming headset,8315, $23.46 ,mobile app,email,email,desktop,desktop,US,TRUE,NA,23.46
9e6fa145,dbb1da9738b66959,20-02-2021,2021-02-20,2021,2,1,2021-02-21,JBL Quantum 100 Gaming Headset,jbl quantum 100 gaming headset,4db1, $13.98 ,mobile app,email,email,desktop,desktop,US,TRUE,NA,13.98
f48e5c29,cfbc860e047103358,20-02-2021,2021-02-20,2021,2,2,2021-02-22,Dell Gaming Mouse,dell gaming mouse,8d4f, $49.98 ,mobile app,direct,direct,desktop,desktop,US,TRUE,NA,49.98
a324b96f,c577fdb05f369033,20-02-2021,2021-02-20,2021,2,3,2021-02-23,JBL Quantum 100 Gaming Headset,jbl quantum 100 gaming headset,4db1, $13.30 ,mobile app,email,email,desktop,desktop,BR,TRUE,EMEA,13.3
6c58d869,fe46937234d46760,20-02-2021,2021-02-20,2021,2,3,2021-02-23,Nintendo Switch,nintendo switch,e682, $168.00 ,website,direct,direct,desktop,desktop,US,TRUE,NA,168.0
58d2215,fe46937234d46760,20-02-2021,2021-02-20,2021,2,3,2021-02-23,Nintendo Switch,nintendo switch,e682, $168.00 ,website,direct,direct,desktop,desktop,US,TRUE,NA,168.0
c41cc161,f70af54bc5183051,20-02-2021,2021-02-20,2021,2,2,2021-02-22,Nintendo Switch,nintendo switch,8d0d, $168.00 ,website,direct,direct,desktop,desktop,US,TRUE,NA,168.0
1cc7847,f70af54bc5183051,20-02-2021,2021-02-20,2021,2,2,2021-02-22,Nintendo Switch,nintendo switch,8d0d, $168.00 ,website,direct,direct,desktop,desktop,US,TRUE,NA,168.0
1fb59039,f506dd844d015990,20-02-2021,2021-02-20,2021,2,3,2021-02-23,27in 4K gaming monitor,27in 4k gaming monitor,e7e6, $480.00 ,website,email,email,desktop,desktop,US,TRUE,NA,480.0
f90aba42,f1c646a52ae105203,20-02-2021,2021-02-20,2021,2,2,2021-02-22,JBL Quantum 100 Gaming Headset,jbl quantum 100 gaming headset,ab0f, $23.24 ,website,direct,direct,desktop,desktop,DE,TRUE,EMEA,23.24
61b365d6,f183820f4fb42443,20-02-2021,2021-02-20,2021,2,1,2021-02-21,Nintendo Switch,nintendo switch,e682, $184.90 ,website,email,email,desktop,desktop,GB,TRUE,EMEA,184.9
b365248,f183820f4fb42443,20-02-2021,2021-02-20,2021,2,1,2021-02-21,Nintendo Switch,nintendo switch,e682, $184.90 ,website,email,email,desktop,desktop,GB,TRUE,EMEA,184.9
f606e8ca,f15b0056058103941,20-02-2021,2021-02-20,2021,2,3,2021-02-23,27in 4K gaming monitor,27in 4k gaming monitor,e7e6, $480.00 ,website,email,email,desktop,desktop,US,TRUE,NA,480.0
f7933dac,ef6803c0689104602,20-02-2021,2021-02-20,2021,2,1,2021-02-21,Nintendo Switch,nintendo switch,e682, $164.69 ,website,direct,direct,desktop,desktop,IT,TRUE,EMEA,164.69
933261,ef6803c0689104602,20-02-2021,2021-02-20,2021,2,1,2021-02-21,Nintendo Switch,nintendo switch,e682, $164.69 ,website,direct,direct,desktop,desktop,IT,TRUE,EMEA,164.69
ec4bd9a6,e61a2591f1c99841,20-02-2021,2021-02-20,2021,2,1,2021-02-21,Nintendo Switch,nintendo switch,e682, $168.00 ,website,direct,direct,desktop,desktop,US,TRUE,NA,168.0
4bd5596,e61a2591f1c99841,20-02-2021,2021-02-20,2021,2,1,2021-02-21,Nintendo Switch,nintendo switch,e682, $168.00 ,website,direct,direct,desktop,desktop,US,TRUE,NA,168.0
4694f68b,e4108224d3031612,20-02-2021,2021-02-20,2021,2,2,2021-02-22,27in 4K gaming monitor,27in 4k gaming monitor,e7e6, $445.79 ,website,affiliate,affiliate,unknown,unknown,DE,TRUE,EMEA,445.79
f2e6db77,d41d63f9082102649,20-02-2021,2021-02-20,2021,2,3,2021-02-23,Nintendo Switch,nintendo switch,8d0d, $164.69 ,website,direct,direct,desktop,desktop,NL,TRUE,EMEA,164.69
d91402f5,d35d88113d791716,20-02-2021,2021-02-20,2021,2,3,2021-02-23,JBL Quantum 100 Gaming Headset,jbl quantum 100 gaming headset,ab0f, $24.00 ,website,direct,direct,desktop,desktop,US,TRUE,NA,24.0
7ec3cce6,d1d8fdbecef54132,20-02-2021,2021-02-20,2021,2,1,2021-02-21,27in 4K gaming monitor,27in 4k gaming monitor,891b, $480.00 ,website,direct,direct,desktop,desktop,US,TRUE,NA,480.0
42140628,cd0ad443a291107,20-02-2021,2021-02-20,2021,2,1,2021-02-21,Nintendo Switch,nintendo switch,e682, $168.00 ,website,direct,direct,desktop,desktop,US,TRUE,NA,168.0
33263878,c3722278fca885,20-02-2021,2021-02-20,2021,2,1,2021-02-21,27in 4K gaming monitor,27in 4k gaming monitor,891b, $470.58 ,website,direct,direct,desktop,desktop,US,TRUE,NA,470.58
a30de682,fa75bb1562e68993,19-02-2021,2021-02-19,2021,2,3,2021-02-22,JBL Quantum 100 Gaming Headset,jbl quantum 100 gaming headset,8315, $23.56 ,mobile app,email,email,desktop,desktop,AE,TRUE,EMEA,23.56
5a0f2640,de2af013bad39355,19-02-2021,2021-02-19,2021,2,2,2021-02-21,Dell Gaming Mouse,dell gaming mouse,8d4f, $49.98 ,mobile app,direct,direct,desktop,desktop,US,TRUE,NA,49.98
452b8b1a,d8158a73f7931079,19-02-2021,2021-02-19,2021,2,1,2021-02-20,Dell Gaming Mouse,dell gaming mouse,8d4f, $49.98 ,mobile app,direct,direct,desktop,desktop,US,TRUE,NA,49.98
83f21678,d4939858fe656159,19-02-2021,2021-02-19,2021,2,1,2021-02-20,JBL Quantum 100 Gaming Headset,jbl quantum 100 gaming headset,4c58, $25.80 ,mobile app,direct,direct,desktop,desktop,PH,TRUE,APAC,25.8
aa4e92f2,d4351ad302972202,19-02-2021,2021-02-19,2021,2,3,2021-02-22,JBL Quantum 100 Gaming Headset,jbl quantum 100 gaming headset,8315, $23.70 ,mobile app,email,email,desktop,desktop,US,TRUE,NA,23.7
f1cb6347,fdc31453b51102190,19-02-2021,2021-02-19,2021,2,3,2021-02-22,Nintendo Switch,nintendo switch,e682, $188.15 ,website,email,email,desktop,desktop,GB,TRUE,EMEA,188.15
cb635,fdc31453b51102190,19-02-2021,2021-02-19,2021,2,3,2021-02-22,Nintendo Switch,nintendo switch,e682, $188.15 ,website,email,email,desktop,desktop,GB,TRUE,EMEA,188.15
f29059bb,f91890c8e3d102511,19-02-2021,2021-02-19,2021,2,3,2021-02-22,27in 4K gaming monitor,27in 4k gaming monitor,891b, $327.22 ,website,direct,direct,desktop,desktop,GB,TRUE,EMEA,327.22
95cf680a,f5a9558963763485,19-02-2021,2021-02-19,2021,2,2,2021-02-21,Lenovo IdeaPad Gaming 3,lenovo ideapad gaming 3,9ef0," $1,198.00 ",website,direct,direct,desktop,desktop,US,TRUE,NA,1198.0
adc6a1aa,f4f04780aeb73646,19-02-2021,2021-02-19,2021,2,1,2021-02-20,Lenovo IdeaPad Gaming 3,lenovo ideapad gaming 3,9ef0," $1,124.68 ",website,direct,direct,desktop,desktop,JP,TRUE,APAC,1124.68
f425b1cc,f454071f749103201,19-02-2021,2021-02-19,2021,2,2,2021-02-21,27in 4K gaming monitor,27in 4k gaming monitor,e7e6, $480.00 ,website,direct,direct,desktop,desktop,US,TRUE,NA,480.0
cf836c3d,ed9a6e00a6387698,19-02-2021,2021-02-19,2021,2,2,2021-02-21,JBL Quantum 100 Gaming Headset,jbl quantum 100 gaming headset,ab0f, $24.00 ,website,direct,direct,desktop,desktop,CZ,TRUE,EMEA,24.0
67404c5a,ed054ae662c44597,19-02-2021,2021-02-19,2021,2,2,2021-02-21,27in 4K gaming monitor,27in 4k gaming monitor,891b, $433.56 ,website,direct,direct,desktop,desktop,JP,TRUE,APAC,433.56
a88e186a,e9d3f860cb371412,19-02-2021,2021-02-19,2021,2,3,2021-02-22,27in 4K gaming monitor,27in 4k gaming monitor,e7e6, $438.79 ,website,direct,direct,desktop,desktop,AU,TRUE,EMEA,438.79
874616bf,e1953f8129457515,19-02-2021,2021-02-19,2021,2,3,2021-02-22,27in 4K gaming monitor,27in 4k gaming monitor,891b, $445.94 ,website,affiliate,affiliate,unknown,unknown,CH,TRUE,EMEA,445.94
2af2e7ec,de44d113bb020387,19-02-2021,2021-02-19,2021,2,1,2021-02-20,27in 4K gaming monitor,27in 4k gaming monitor,891b, $389.32 ,website,email,email,desktop,desktop,US,TRUE,NA,389.32
61915127,dc1d3a947161631,19-02-2021,2021-02-19,2021,2,1,2021-02-20,JBL Quantum 100 Gaming Headset,jbl quantum 100 gaming headset,ab0f, $26.80 ,website,email,email,desktop,desktop,GB,TRUE,EMEA,26.8
41910546,db351dc51a71099,19-02-2021,2021-02-19,2021,2,1,2021-02-20,Nintendo Switch,nintendo switch,e682, $168.00 ,website,direct,direct,desktop,desktop,US,TRUE,NA,168.0
ad5e907d,d69897ef73e73465,19-02-2021,2021-02-19,2021,2,1,2021-02-20,27in 4K gaming monitor,27in 4k gaming monitor,891b, $480.00 ,website,direct,direct,desktop,desktop,US,TRUE,NA,480.0
90146995,d66c382a8792387,19-02-2021,2021-02-19,2021,2,3,2021-02-22,Nintendo Switch,nintendo switch,e682, $168.00 ,website,direct,direct,desktop,desktop,US,TRUE,NA,168.0
377a34ef,d356943765a25462,19-02-2021,2021-02-19,2021,2,2,2021-02-21,Nintendo Switch,nintendo switch,e682, $168.00 ,website,direct,direct,desktop,desktop,US,TRUE,NA,168.0
b3023d2e,d1f9260413075851,19-02-2021,2021-02-19,2021,2,2,2021-02-21,Nintendo Switch,nintendo switch,8d0d, $168.00 ,website,social media,social media,tablet,tablet,US,TRUE,NA,168.0
3d330d25,d085d7f2b8127783,19-02-2021,2021-02-19,2021,2,2,2021-02-21,Nintendo Switch,nintendo switch,e682, $168.00 ,website,direct,direct,desktop,desktop,US,TRUE,NA,168.0
acb89ded,cc662b02cc373179,19-02-2021,2021-02-19,2021,2,1,2021-02-20,Lenovo IdeaPad Gaming 3,lenovo ideapad gaming 3,9ef0," $1,283.57 ",website,direct,direct,desktop,desktop,GB,TRUE,EMEA,1283.57
65abf7b4,cc4f6ff7e9543947,19-02-2021,2021-02-19,2021,2,3,2021-02-22,27in 4K gaming monitor,27in 4k gaming monitor,891b, $430.76 ,website,direct,direct,desktop,desktop,US,TRUE,NA,430.76
8c693a83,ca44966280c59653,19-02-2021,2021-02-19,2021,2,2,2021-02-21,Nintendo Switch,nintendo switch,e682, $168.00 ,website,direct,direct,desktop,desktop,US,TRUE,NA,168.0
2fe92d1c,c9fd6d64da622478,19-02-2021,2021-02-19,2021,2,3,2021-02-22,Nintendo Switch,nintendo switch,e682, $164.69 ,website,direct,direct,desktop,desktop,ES,TRUE,EMEA,164.69
f4af36bf,c4ffdc94319103406,19-02-2021,2021-02-19,2021,2,3,2021-02-22,JBL Quantum 100 Gaming Headset,jbl quantum 100 gaming headset,ab0f, $23.90 ,website,direct,direct,desktop,desktop,IT,TRUE,EMEA,23.9
22979d50,c0485633e7017027,19-02-2021,2021-02-19,2021,2,1,2021-02-20,Nintendo Switch,nintendo switch,e682, $188.15 ,website,direct,direct,desktop,desktop,GB,TRUE,EMEA,188.15
d8e46e1b,bcc9a9ba1ba91643,19-02-2021,2021-02-19,2021,2,1,2021-02-20,Nintendo Switch,nintendo switch,e682, $168.00 ,website,direct,direct,desktop,desktop,US,TRUE,NA,168.0
564c05db,bbf8a751ef637894,19-02-2021,2021-02-19,2021,2,3,2021-02-22,Lenovo IdeaPad Gaming 3,lenovo ideapad gaming 3,9ef0," $1,198.00 ",website,direct,direct,desktop,desktop,SA,TRUE,EMEA,1198.0
b328854d,b85408949f775921,19-02-2021,2021-02-19,2021,2,2,2021-02-21,27in 4K gaming monitor,27in 4k gaming monitor,e7e6, $480.00 ,website,direct,direct,desktop,desktop,CL,TRUE,EMEA,480.0
f015d6d2,b791d137566101455,19-02-2021,2021-02-19,2021,2,2,2021-02-21,Nintendo Switch,nintendo switch,e682, $151.46 ,website,direct,direct,desktop,desktop,AU,TRUE,EMEA,151.46
4f2f4fcd,f927e1154be35124,18-02-2021,2021-02-18,2021,2,1,2021-02-19,JBL Quantum 100 Gaming Headset,jbl quantum 100 gaming headset,4c58, $13.98 ,mobile app,direct,direct,desktop,desktop,US,TRUE,NA,13.98
b0ce3024,f2f73f7ff2e74928,18-02-2021,2021-02-18,2021,2,1,2021-02-19,JBL Quantum 100 Gaming Headset,jbl quantum 100 gaming headset,8315, $23.58 ,mobile app,email,email,desktop,desktop,US,TRUE,NA,23.58
a1db3860,f15b2615d4868464,18-02-2021,2021-02-18,2021,2,2,2021-02-20,JBL Quantum 100 Gaming Headset,jbl quantum 100 gaming headset,4db1, $13.98 ,mobile app,email,email,desktop,desktop,US,TRUE,NA,13.98
f2417738,f1374c93c82102365,18-02-2021,2021-02-18,2021,2,2,2021-02-20,JBL Quantum 100 Gaming Headset,jbl quantum 100 gaming headset,4db1, $13.80 ,mobile app,email,email,desktop,desktop,IE,TRUE,EMEA,13.8
f870961e,eb4d4815943104967,18-02-2021,2021-02-18,2021,2,2,2021-02-20,Dell Gaming Mouse,dell gaming mouse,f81e, $53.36 ,mobile app,email,email,desktop,desktop,GB,TRUE,EMEA,53.36
6ff5d588,e74e9925ea148271,18-02-2021,2021-02-18,2021,2,2,2021-02-20,Dell Gaming Mouse,dell gaming mouse,f81e, $49.98 ,mobile app,email,email,desktop,desktop,US,TRUE,NA,49.98
3a9c042e,dd99997322e26703,18-02-2021,2021-02-18,2021,2,3,2021-02-21,Dell Gaming Mouse,dell gaming mouse,8d4f, $49.98 ,mobile app,social media,social media,tablet,tablet,US,TRUE,NA,49.98
dac45afe,cf470df538e92432,18-02-2021,2021-02-18,2021,2,2,2021-02-20,Dell Gaming Mouse,dell gaming mouse,8d4f, $48.85 ,mobile app,direct,direct,desktop,desktop,MX,TRUE,LATAM,48.85
48a1893d,c5c52aa46c532405,18-02-2021,2021-02-18,2021,2,1,2021-02-19,JBL Quantum 100 Gaming Headset,jbl quantum 100 gaming headset,4db1, $13.24 ,mobile app,email,email,desktop,desktop,MX,TRUE,LATAM,13.24
aefd220f,fdc874cdd3c74166,18-02-2021,2021-02-18,2021,2,2,2021-02-20,JBL Quantum 100 Gaming Headset,jbl quantum 100 gaming headset,ab0f, $23.90 ,website,direct,direct,desktop,desktop,BE,TRUE,EMEA,23.9
24fddf30,faeed02734f17950,18-02-2021,2021-02-18,2021,2,3,2021-02-21,Nintendo Switch,nintendo switch,8d0d, $162.75 ,website,direct,direct,desktop,desktop,ES,TRUE,EMEA,162.75
fdd3234,faeed02734f17950,18-02-2021,2021-02-18,2021,2,3,2021-02-21,Nintendo Switch,nintendo switch,8d0d, $162.75 ,website,direct,direct,desktop,desktop,ES,TRUE,EMEA,162.75
4131fe8b,f0b2d2a7b3f29472,18-02-2021,2021-02-18,2021,2,3,2021-02-21,Nintendo Switch,nintendo switch,e682, $164.69 ,website,social media,social media,tablet,tablet,ES,TRUE,EMEA,164.69
31f5589,f0b2d2a7b3f29472,18-02-2021,2021-02-18,2021,2,3,2021-02-21,Nintendo Switch,nintendo switch,e682, $164.69 ,website,social media,social media,tablet,tablet,ES,TRUE,EMEA,164.69
ccb819bc,e965abf619886481,18-02-2021,2021-02-18,2021,2,1,2021-02-19,27in 4K gaming monitor,27in 4k gaming monitor,e7e6, $480.00 ,website,email,email,desktop,desktop,BB,TRUE,EMEA,480.0
18d41108,e45770836b313082,18-02-2021,2021-02-18,2021,2,3,2021-02-21,Nintendo Switch,nintendo switch,e682, $168.00 ,website,direct,direct,desktop,desktop,US,TRUE,NA,168.0
d415794,e45770836b313082,18-02-2021,2021-02-18,2021,2,3,2021-02-21,Nintendo Switch,nintendo switch,e682, $168.00 ,website,direct,direct,desktop,desktop,US,TRUE,NA,168.0
059c3fe7,e381bba11bc5401,18-02-2021,2021-02-18,2021,2,1,2021-02-19,Sony PlayStation 5 Bundle,sony playstation 5 bundle,54ed," $1,706.16 ",website,direct,direct,desktop,desktop,FR,TRUE,EMEA,1706.16
431d9c1a,e032e79807630227,18-02-2021,2021-02-18,2021,2,1,2021-02-19,JBL Quantum 100 Gaming Headset,jbl quantum 100 gaming headset,ab0f, $24.00 ,website,email,email,desktop,desktop,US,TRUE,NA,24.0
2188cf7e,d6cae6336d016647,18-02-2021,2021-02-18,2021,2,1,2021-02-19,Nintendo Switch,nintendo switch,e682, $168.00 ,website,email,email,desktop,desktop,US,TRUE,NA,168.0
2cb29a56,cdd192e251b21096,18-02-2021,2021-02-18,2021,2,1,2021-02-19,27in 4K gaming monitor,27in 4k gaming monitor,891b, $324.42 ,website,direct,direct,desktop,desktop,LB,TRUE,EMEA,324.42
65fa63b8,cb588392b4244095,18-02-2021,2021-02-18,2021,2,3,2021-02-21,Nintendo Switch,nintendo switch,e682, $157.95 ,website,direct,direct,desktop,desktop,CA,TRUE,EMEA,157.95
77847ea0,cadb7f1582e51178,18-02-2021,2021-02-18,2021,2,1,2021-02-19,JBL Quantum 100 Gaming Headset,jbl quantum 100 gaming headset,ab0f, $23.90 ,website,affiliate,affiliate,unknown,unknown,NL,TRUE,EMEA,23.9
dbe8da5d,c959d38f88092932,18-02-2021,2021-02-18,2021,2,1,2021-02-19,Nintendo Switch,nintendo switch,e682, $159.73 ,website,direct,direct,desktop,desktop,JP,TRUE,APAC,159.73
f825a9a0,c6eb7ee53e0104826,18-02-2021,2021-02-18,2021,2,2,2021-02-20,Nintendo Switch,nintendo switch,8d0d, $168.00 ,website,affiliate,affiliate,unknown,unknown,US,TRUE,NA,168.0
1713a2b9,c5f077544c212402,18-02-2021,2021-02-18,2021,2,2,2021-02-20,Nintendo Switch,nintendo switch,e682, $168.00 ,website,direct,direct,desktop,desktop,US,TRUE,NA,168.0
e54ee690,c4a9c0a82b796867,18-02-2021,2021-02-18,2021,2,2,2021-02-20,Nintendo Switch,nintendo switch,8d0d, $168.00 ,website,direct,direct,desktop,desktop,US,TRUE,NA,168.0
eb174a5d,c0ebc7777f199338,18-02-2021,2021-02-18,2021,2,3,2021-02-21,JBL Quantum 100 Gaming Headset,jbl quantum 100 gaming headset,ab0f, $27.38 ,website,direct,direct,desktop,desktop,GB,TRUE,EMEA,27.38
250cce83,be6f87ae78317976,18-02-2021,2021-02-18,2021,2,1,2021-02-19,Nintendo Switch,nintendo switch,e682, $153.10 ,website,direct,direct,desktop,desktop,CH,TRUE,EMEA,153.1
52623a19,ba978a8e60e36340,18-02-2021,2021-02-18,2021,2,2,2021-02-20,Nintendo Switch,nintendo switch,8d0d, $168.00 ,website,direct,direct,desktop,desktop,US,TRUE,NA,168.0
1d21781b,f4da28b70b314912,17-02-2021,2021-02-17,2021,2,1,2021-02-18,JBL Quantum 100 Gaming Headset,jbl quantum 100 gaming headset,4c58, $32.13 ,mobile app,direct,direct,desktop,desktop,GB,TRUE,EMEA,32.13
e0994861,dbd51378e7b94970,17-02-2021,2021-02-17,2021,2,1,2021-02-18,JBL Quantum 100 Gaming Headset,jbl quantum 100 gaming headset,8315, $23.60 ,mobile app,email,email,desktop,desktop,US,TRUE,NA,23.6
a6202800,cf2489c84c870390,17-02-2021,2021-02-17,2021,2,2,2021-02-19,Dell Gaming Mouse,dell gaming mouse,8d4f, $49.98 ,mobile app,direct,direct,desktop,desktop,AR,TRUE,EMEA,49.98
2e5589e3,b6ed1d4a5cd21766,17-02-2021,2021-02-17,2021,2,1,2021-02-18,Nintendo Switch,nintendo switch,8e5d, $165.98 ,mobile app,email,email,desktop,desktop,GB,TRUE,EMEA,165.98
c577d284,fde25d74b6983566,17-02-2021,2021-02-17,2021,2,2,2021-02-19,27in 4K gaming monitor,27in 4k gaming monitor,e7e6, $517.58 ,website,direct,direct,desktop,desktop,GB,TRUE,EMEA,517.58
590e871b,fa029ddef9c38956,17-02-2021,2021-02-17,2021,2,2,2021-02-19,Sony PlayStation 5 Bundle,sony playstation 5 bundle,54ed," $1,951.95 ",website,direct,direct,desktop,desktop,DE,TRUE,EMEA,1951.95
0e89846,fa029ddef9c38956,17-02-2021,2021-02-17,2021,2,2,2021-02-19,Sony PlayStation 5 Bundle,sony playstation 5 bundle,54ed," $1,951.95 ",website,direct,direct,desktop,desktop,DE,TRUE,EMEA,1951.95
ff7b8d51,f791434c91e107879,17-02-2021,2021-02-17,2021,2,2,2021-02-19,27in 4K gaming monitor,27in 4k gaming monitor,891b, $376.86 ,website,direct,direct,desktop,desktop,US,TRUE,NA,376.86
8ff1145c,f3e1bed4ace61098,17-02-2021,2021-02-17,2021,2,1,2021-02-18,Nintendo Switch,nintendo switch,8d0d, $184.90 ,website,email,email,desktop,desktop,GB,TRUE,EMEA,184.9
f117246,f3e1bed4ace61098,17-02-2021,2021-02-17,2021,2,1,2021-02-18,Nintendo Switch,nintendo switch,8d0d, $184.90 ,website,email,email,desktop,desktop,GB,TRUE,EMEA,184.9
0de88292,f0cb97d10778714,17-02-2021,2021-02-17,2021,2,3,2021-02-20,27in 4K gaming monitor,27in 4k gaming monitor,e7e6, $480.00 ,website,direct,direct,desktop,desktop,CL,TRUE,EMEA,480.0
7abc09b9,efe89b3265852435,17-02-2021,2021-02-17,2021,2,1,2021-02-18,Nintendo Switch,nintendo switch,e682, $168.00 ,website,direct,direct,desktop,desktop,US,TRUE,NA,168.0
bc01104,efe89b3265852435,17-02-2021,2021-02-17,2021,2,1,2021-02-18,Nintendo Switch,nintendo switch,e682, $168.00 ,website,direct,direct,desktop,desktop,US,TRUE,NA,168.0
a6195c64,eef3a7b816b70375,17-02-2021,2021-02-17,2021,2,3,2021-02-20,JBL Quantum 100 Gaming Headset,jbl quantum 100 gaming headset,ab0f, $24.00 ,website,direct,direct,desktop,desktop,US,TRUE,NA,24.0
a0895503,eea8dd9fb5b67900,17-02-2021,2021-02-17,2021,2,2,2021-02-19,Nintendo Switch,nintendo switch,8d0d, $168.00 ,website,email,email,desktop,desktop,US,TRUE,NA,168.0
9528559,eea8dd9fb5b67900,17-02-2021,2021-02-17,2021,2,2,2021-02-19,Nintendo Switch,nintendo switch,8d0d, $168.00 ,website,email,email,desktop,desktop,US,TRUE,NA,168.0
4e8484ed,ed03850d24734842,17-02-2021,2021-02-17,2021,2,1,2021-02-18,Nintendo Switch,nintendo switch,e682, $153.35 ,website,social media,social media,tablet,tablet,JP,TRUE,APAC,153.35
8486749,ed03850d24734842,17-02-2021,2021-02-17,2021,2,1,2021-02-18,Nintendo Switch,nintendo switch,e682, $153.35 ,website,social media,social media,tablet,tablet,JP,TRUE,APAC,153.35
344eaa84,ec560d2078c24211,17-02-2021,2021-02-17,2021,2,2,2021-02-19,27in 4K gaming monitor,27in 4k gaming monitor,891b, $506.46 ,website,direct,direct,desktop,desktop,GB,TRUE,EMEA,506.46
1db784b3,e509cb7943815177,17-02-2021,2021-02-17,2021,2,1,2021-02-18,27in 4K gaming monitor,27in 4k gaming monitor,891b, $480.00 ,website,direct,direct,desktop,desktop,US,TRUE,NA,480.0
1bcd3f67,e14ad6a59c814331,17-02-2021,2021-02-17,2021,2,3,2021-02-20,Nintendo Switch,nintendo switch,e682, $168.00 ,website,direct,direct,desktop,desktop,TH,TRUE,APAC,168.0
07e5f72a,de03fe6a9766293,17-02-2021,2021-02-17,2021,2,2,2021-02-19,Nintendo Switch,nintendo switch,8d0d, $168.00 ,website,direct,direct,desktop,desktop,US,TRUE,NA,168.0
c52998b4,dde7d2cba7383425,17-02-2021,2021-02-17,2021,2,1,2021-02-18,Nintendo Switch,nintendo switch,e682, $157.95 ,website,email,email,desktop,desktop,CA,TRUE,EMEA,157.95
092d7ac1,dcaaf6f29d46789,17-02-2021,2021-02-17,2021,2,3,2021-02-20,Sony PlayStation 5 Bundle,sony playstation 5 bundle,54ed," $1,749.84 ",website,direct,direct,desktop,desktop,US,TRUE,NA,1749.84
3ec2873e,d273ced7e8928448,17-02-2021,2021-02-17,2021,2,2,2021-02-19,JBL Quantum 100 Gaming Headset,jbl quantum 100 gaming headset,ab0f, $20.11 ,website,direct,direct,desktop,desktop,CA,TRUE,EMEA,20.11
0aaa138e,d0c494ae63b7387,17-02-2021,2021-02-17,2021,2,2,2021-02-19,27in 4K gaming monitor,27in 4k gaming monitor,e7e6, $584.09 ,website,direct,direct,desktop,desktop,IL,TRUE,EMEA,584.09
1cf249b2,cde760035a814832,17-02-2021,2021-02-17,2021,2,3,2021-02-20,Nintendo Switch,nintendo switch,e682, $164.88 ,website,email,email,desktop,desktop,DE,TRUE,EMEA,164.88
108ec7e4,cd24f5c06cf9797,17-02-2021,2021-02-17,2021,2,2,2021-02-19,27in 4K gaming monitor,27in 4k gaming monitor,e7e6, $480.00 ,website,direct,direct,desktop,desktop,US,TRUE,NA,480.0
bdad253a,cc34accd99080283,17-02-2021,2021-02-17,2021,2,2,2021-02-19,Nintendo Switch,nintendo switch,8d0d, $168.00 ,website,direct,direct,desktop,desktop,VN,TRUE,APAC,168.0
30070ed2,cb06f52ecc722523,17-02-2021,2021-02-17,2021,2,3,2021-02-20,Nintendo Switch,nintendo switch,e682, $168.00 ,website,direct,direct,desktop,desktop,US,TRUE,NA,168.0
84f39c43,bad6a42aad356567,17-02-2021,2021-02-17,2021,2,3,2021-02-20,27in 4K gaming monitor,27in 4k gaming monitor,e7e6, $480.00 ,website,email,email,desktop,desktop,US,TRUE,NA,480.0
e3e7999b,b745841a05996268,17-02-2021,2021-02-17,2021,2,3,2021-02-20,Nintendo Switch,nintendo switch,e682, $150.92 ,website,direct,direct,desktop,desktop,RU,TRUE,APAC,150.92
6bac7306,f30c4b6b03146459,16-02-2021,2021-02-16,2021,2,1,2021-02-17,Dell Gaming Mouse,dell gaming mouse,f81e, $53.16 ,mobile app,email,email,desktop,desktop,AU,TRUE,EMEA,53.16
e09eb8e6,f1d90ad314594980,16-02-2021,2021-02-16,2021,2,1,2021-02-17,Dell Gaming Mouse,dell gaming mouse,8d4f, $58.94 ,mobile app,direct,direct,desktop,desktop,ES,TRUE,EMEA,58.94
261d72b2,e653c2253ff18435,16-02-2021,2021-02-16,2021,2,3,2021-02-19,Dell Gaming Mouse,dell gaming mouse,f81e, $53.36 ,mobile app,email,email,desktop,desktop,GB,TRUE,EMEA,53.36
77112600000,d225b02b7652728,16-02-2021,2021-02-16,2021,2,1,2021-02-17,JBL Quantum 100 Gaming Headset,jbl quantum 100 gaming headset,4db1, $13.26 ,mobile app,email,email,desktop,desktop,IL,TRUE,EMEA,13.26
6d1def04,fba1269f5bc47097,16-02-2021,2021-02-16,2021,2,2,2021-02-18,27in 4K gaming monitor,27in 4k gaming monitor,e7e6, $480.00 ,website,direct,direct,desktop,desktop,CZ,TRUE,EMEA,480.0
90ffe2c8,f9d114e5bbe61482,16-02-2021,2021-02-16,2021,2,3,2021-02-19,Nintendo Switch,nintendo switch,8d0d, $168.00 ,website,direct,direct,desktop,desktop,US,TRUE,NA,168.0
ffe285,f9d114e5bbe61482,16-02-2021,2021-02-16,2021,2,3,2021-02-19,Nintendo Switch,nintendo switch,8d0d, $168.00 ,website,direct,direct,desktop,desktop,US,TRUE,NA,168.0
ec1cc7bf,f3b314f0ad899757,16-02-2021,2021-02-16,2021,2,3,2021-02-19,JBL Quantum 100 Gaming Headset,jbl quantum 100 gaming headset,ab0f, $27.06 ,website,email,email,desktop,desktop,GB,TRUE,EMEA,27.06
85d4094b,f36bdf9ce7c56916,16-02-2021,2021-02-16,2021,2,2,2021-02-18,Nintendo Switch,nintendo switch,e682, $168.00 ,website,direct,direct,desktop,desktop,US,TRUE,NA,168.0
d402199,f36bdf9ce7c56916,16-02-2021,2021-02-16,2021,2,2,2021-02-18,Nintendo Switch,nintendo switch,e682, $168.00 ,website,direct,direct,desktop,desktop,US,TRUE,NA,168.0
9d1f0792,eea8611cdee66438,16-02-2021,2021-02-16,2021,2,2,2021-02-18,27in 4K gaming monitor,27in 4k gaming monitor,891b, $450.62 ,website,direct,direct,desktop,desktop,JP,TRUE,APAC,450.62
f7283b13,e4246d5dfdb104427,16-02-2021,2021-02-16,2021,2,2,2021-02-18,27in 4K gaming monitor,27in 4k gaming monitor,891b, $433.98 ,website,direct,direct,desktop,desktop,US,TRUE,NA,433.98
002e219f,e2b01298be73228,16-02-2021,2021-02-16,2021,2,1,2021-02-17,Nintendo Switch,nintendo switch,e682, $188.15 ,website,email,email,desktop,desktop,GB,TRUE,EMEA,188.15
7e4cb11c,dfd7e5b91ce53940,16-02-2021,2021-02-16,2021,2,3,2021-02-19,Nintendo Switch,nintendo switch,e682, $168.00 ,website,direct,direct,desktop,desktop,US,TRUE,NA,168.0
273285d1,d6d4592d01018880,16-02-2021,2021-02-16,2021,2,1,2021-02-17,Nintendo Switch,nintendo switch,8d0d, $168.00 ,website,direct,direct,desktop,desktop,US,TRUE,NA,168.0
a8e7da97,d4ca3476ff671584,16-02-2021,2021-02-16,2021,2,2,2021-02-18,Nintendo Switch,nintendo switch,8d0d, $168.00 ,website,direct,direct,desktop,desktop,US,TRUE,NA,168.0
b73f8c0c,d39ce96a86577636,16-02-2021,2021-02-16,2021,2,1,2021-02-17,Nintendo Switch,nintendo switch,8d0d, $168.00 ,website,direct,direct,desktop,desktop,US,TRUE,NA,168.0
f837b9d5,d38fae3fef8104857,16-02-2021,2021-02-16,2021,2,1,2021-02-17,Nintendo Switch,nintendo switch,8d0d, $126.00 ,website,direct,direct,desktop,desktop,TT,TRUE,NA,126.0
e68ac178,d203800d40797395,16-02-2021,2021-02-16,2021,2,3,2021-02-19,27in 4K gaming monitor,27in 4k gaming monitor,e7e6, $445.79 ,website,direct,direct,desktop,desktop,ES,TRUE,EMEA,445.79
8823ca88,d11ae302e4b57852,16-02-2021,2021-02-16,2021,2,1,2021-02-17,Nintendo Switch,nintendo switch,8d0d, $159.73 ,website,direct,direct,desktop,desktop,JP,TRUE,APAC,159.73
211e5aaa,ccd19c3ecf616506,16-02-2021,2021-02-16,2021,2,1,2021-02-17,Nintendo Switch,nintendo switch,8d0d, $162.75 ,website,direct,direct,desktop,desktop,AT,TRUE,EMEA,162.75
932a5a6f,c80e58c852162449,16-02-2021,2021-02-16,2021,2,2,2021-02-18,27in 4K gaming monitor,27in 4k gaming monitor,e7e6, $451.10 ,website,direct,direct,desktop,desktop,NL,TRUE,EMEA,451.1
1.126E+129,c73fdb992f73104,16-02-2021,2021-02-16,2021,2,1,2021-02-17,Nintendo Switch,nintendo switch,e682, $168.00 ,website,email,email,desktop,desktop,US,TRUE,NA,168.0
aebda8df,b70ecb5030274062,16-02-2021,2021-02-16,2021,2,3,2021-02-19,Nintendo Switch,nintendo switch,8d0d, $158.32 ,website,direct,direct,desktop,desktop,CA,TRUE,EMEA,158.32
36e7d8b7,e7730d74dbc25244,15-02-2021,2021-02-15,2021,2,3,2021-02-18,Dell Gaming Mouse,dell gaming mouse,f81e, $51.62 ,mobile app,email,email,desktop,desktop,PH,TRUE,APAC,51.62
7b4f5676,e0e2c49291c52698,15-02-2021,2021-02-15,2021,2,1,2021-02-16,JBL Quantum 100 Gaming Headset,jbl quantum 100 gaming headset,4db1, $23.98 ,mobile app,direct,direct,desktop,desktop,US,TRUE,NA,23.98
445c1ae3,ce6fe8035db30752,15-02-2021,2021-02-15,2021,2,1,2021-02-16,Dell Gaming Mouse,dell gaming mouse,8d4f, $67.07 ,mobile app,direct,direct,desktop,desktop,GB,TRUE,EMEA,67.07
91f55787,c4af0c617a961913,15-02-2021,2021-02-15,2021,2,1,2021-02-16,JBL Quantum 100 Gaming Headset,jbl quantum 100 gaming headset,4c58, $14.88 ,mobile app,direct,direct,desktop,desktop,CA,TRUE,EMEA,14.88
ee510717,bbae91b2605100672,15-02-2021,2021-02-15,2021,2,1,2021-02-16,Dell Gaming Mouse,dell gaming mouse,8d4f, $51.71 ,mobile app,direct,direct,desktop,desktop,CA,TRUE,EMEA,51.71
9f1fa198,fd9f554a76a67265,15-02-2021,2021-02-15,2021,2,1,2021-02-16,Sony PlayStation 5 Bundle,sony playstation 5 bundle,54ed," $1,800.00 ",website,direct,direct,desktop,desktop,IN,TRUE,APAC,1800.0
1fa8736,fd9f554a76a67265,15-02-2021,2021-02-15,2021,2,1,2021-02-16,Sony PlayStation 5 Bundle,sony playstation 5 bundle,54ed," $1,800.00 ",website,direct,direct,desktop,desktop,IN,TRUE,APAC,1800.0
08fd14fe,e7d9f734d7f6714,15-02-2021,2021-02-15,2021,2,3,2021-02-18,Nintendo Switch,nintendo switch,e682, $160.34 ,website,direct,direct,desktop,desktop,ES,TRUE,EMEA,160.34
fd11608,e7d9f734d7f6714,15-02-2021,2021-02-15,2021,2,3,2021-02-18,Nintendo Switch,nintendo switch,e682, $160.34 ,website,direct,direct,desktop,desktop,ES,TRUE,EMEA,160.34
266f80ce,e7bd4116aa718562,15-02-2021,2021-02-15,2021,2,2,2021-02-17,Nintendo Switch,nintendo switch,8d0d, $153.35 ,website,direct,direct,desktop,desktop,JP,TRUE,APAC,153.35
6f8118,e7bd4116aa718562,15-02-2021,2021-02-15,2021,2,2,2021-02-17,Nintendo Switch,nintendo switch,8d0d, $153.35 ,website,direct,direct,desktop,desktop,JP,TRUE,APAC,153.35
a18337ff,e522155cc4168330,15-02-2021,2021-02-15,2021,2,1,2021-02-16,JBL Quantum 100 Gaming Headset,jbl quantum 100 gaming headset,ab0f, $18.28 ,website,direct,direct,desktop,desktop,AU,TRUE,EMEA,18.28
bd89bd79,e26ffe0fd6080239,15-02-2021,2021-02-15,2021,2,2,2021-02-17,27in 4K gaming monitor,27in 4k gaming monitor,891b, $330.42 ,website,direct,direct,desktop,desktop,US,TRUE,NA,330.42
c9c51b96,e158886f8cf85300,15-02-2021,2021-02-15,2021,2,1,2021-02-16,Sony PlayStation 5 Bundle,sony playstation 5 bundle,54ed," $1,800.00 ",website,direct,direct,desktop,desktop,US,TRUE,NA,1800.0
4b8b34a0,defbf930ae133570,15-02-2021,2021-02-15,2021,2,2,2021-02-17,Nintendo Switch,nintendo switch,e682, $168.00 ,website,direct,direct,desktop,desktop,US,TRUE,NA,168.0
78cbe0a5,d9c6668431d51659,15-02-2021,2021-02-15,2021,2,2,2021-02-17,27in 4K gaming monitor,27in 4k gaming monitor,e7e6, $431.90 ,website,direct,direct,desktop,desktop,AU,TRUE,EMEA,431.9
fee9216e,d54e5994781107659,15-02-2021,2021-02-15,2021,2,2,2021-02-17,27in 4K gaming monitor,27in 4k gaming monitor,891b, $480.00 ,website,direct,direct,desktop,desktop,US,TRUE,NA,480.0
93eedc13,ced1f1be33362718,15-02-2021,2021-02-15,2021,2,2,2021-02-17,Nintendo Switch,nintendo switch,e682, $168.00 ,website,direct,direct,desktop,desktop,US,TRUE,NA,168.0
d091ce60,c5299f5079a88099,15-02-2021,2021-02-15,2021,2,1,2021-02-16,27in 4K gaming monitor,27in 4k gaming monitor,e7e6, $480.00 ,website,email,email,desktop,desktop,US,TRUE,NA,480.0
64463cf9,c179d58996543399,15-02-2021,2021-02-15,2021,2,1,2021-02-16,Nintendo Switch,nintendo switch,e682, $168.00 ,website,direct,direct,desktop,desktop,US,TRUE,NA,168.0
b6994389,b74789e39f877359,15-02-2021,2021-02-15,2021,2,2,2021-02-17,Nintendo Switch,nintendo switch,e682, $168.00 ,website,direct,direct,desktop,desktop,US,TRUE,NA,168.0
2adbe528,fb0f432f67020353,14-02-2021,2021-02-14,2021,2,3,2021-02-17,Dell Gaming Mouse,dell gaming mouse,8d4f, $49.98 ,mobile app,direct,direct,desktop,desktop,PA,TRUE,LATAM,49.98
e79cf092,f0ec1f44a3297828,14-02-2021,2021-02-14,2021,2,1,2021-02-15,JBL Quantum 100 Gaming Headset,jbl quantum 100 gaming headset,4c58, $19.14 ,mobile app,direct,direct,desktop,desktop,GB,TRUE,EMEA,19.14
9eda8597,e992fd5435d67147,14-02-2021,2021-02-14,2021,2,1,2021-02-15,Dell Gaming Mouse,dell gaming mouse,8d4f, $49.98 ,mobile app,direct,direct,desktop,desktop,US,TRUE,NA,49.98
d10e45a1,e387796743b88282,14-02-2021,2021-02-14,2021,2,3,2021-02-17,Dell Gaming Mouse,dell gaming mouse,8d4f, $49.98 ,mobile app,unknown,unknown,unknown,unknown,US,TRUE,NA,49.98
91f81dad,cfd7c9b388261917,14-02-2021,2021-02-14,2021,2,3,2021-02-17,JBL Quantum 100 Gaming Headset,jbl quantum 100 gaming headset,4db1, $13.61 ,mobile app,email,email,desktop,desktop,GB,TRUE,EMEA,13.61
de58975e,c809e47e47493968,14-02-2021,2021-02-14,2021,2,2,2021-02-16,JBL Quantum 100 Gaming Headset,jbl quantum 100 gaming headset,4db1, $13.98 ,mobile app,email,email,desktop,desktop,US,TRUE,NA,13.98
60635634,ffe347d9f901613,14-02-2021,2021-02-14,2021,2,2,2021-02-16,27in 4K gaming monitor,27in 4k gaming monitor,e7e6, $480.00 ,website,direct,direct,desktop,desktop,US,TRUE,NA,480.0
7b1b6b29,fd6f595ebe052609,14-02-2021,2021-02-14,2021,2,1,2021-02-15,27in 4K gaming monitor,27in 4k gaming monitor,891b, $317.62 ,website,direct,direct,desktop,desktop,US,TRUE,NA,317.62
8be9cb91,fbfd11c0ec759440,14-02-2021,2021-02-14,2021,2,3,2021-02-17,27in 4K gaming monitor,27in 4k gaming monitor,e7e6, $480.00 ,website,direct,direct,desktop,desktop,RS,TRUE,EMEA,480.0
c311a933,f7fe3434c5782622,14-02-2021,2021-02-14,2021,2,1,2021-02-15,Nintendo Switch,nintendo switch,e682, $186.73 ,website,direct,direct,desktop,desktop,GB,TRUE,EMEA,186.73
11a1254,f7fe3434c5782622,14-02-2021,2021-02-14,2021,2,1,2021-02-15,Nintendo Switch,nintendo switch,e682, $186.73 ,website,direct,direct,desktop,desktop,GB,TRUE,EMEA,186.73
54110081,f708ca39fe21424,14-02-2021,2021-02-14,2021,2,2,2021-02-16,Lenovo IdeaPad Gaming 3,lenovo ideapad gaming 3,04ac," $1,198.00 ",website,direct,direct,desktop,desktop,US,TRUE,NA,1198.0
050927de,f2bff88d2085179,14-02-2021,2021-02-14,2021,2,1,2021-02-15,Nintendo Switch,nintendo switch,e682, $168.00 ,website,email,email,desktop,desktop,US,TRUE,NA,168.0
0927954,f2bff88d2085179,14-02-2021,2021-02-14,2021,2,1,2021-02-15,Nintendo Switch,nintendo switch,e682, $168.00 ,website,email,email,desktop,desktop,US,TRUE,NA,168.0
af98a418,f240912718d74411,14-02-2021,2021-02-14,2021,2,3,2021-02-17,Nintendo Switch,nintendo switch,e682, $184.90 ,website,direct,direct,desktop,desktop,GB,TRUE,EMEA,184.9
98a4223,f240912718d74411,14-02-2021,2021-02-14,2021,2,3,2021-02-17,Nintendo Switch,nintendo switch,e682, $184.90 ,website,direct,direct,desktop,desktop,GB,TRUE,EMEA,184.9
e6d7aee8,f18a2155b0e97517,14-02-2021,2021-02-14,2021,2,2,2021-02-16,Nintendo Switch,nintendo switch,e682, $164.69 ,website,direct,direct,desktop,desktop,DE,TRUE,EMEA,164.69
d7a5706,f18a2155b0e97517,14-02-2021,2021-02-14,2021,2,2,2021-02-16,Nintendo Switch,nintendo switch,e682, $164.69 ,website,direct,direct,desktop,desktop,DE,TRUE,EMEA,164.69
71cf2098,e7d6cf9e21248912,14-02-2021,2021-02-14,2021,2,3,2021-02-17,27in 4K gaming monitor,27in 4k gaming monitor,891b, $445.79 ,website,direct,direct,desktop,desktop,ES,TRUE,EMEA,445.79
ee2e92fc,df93f95cfb5100611,14-02-2021,2021-02-14,2021,2,3,2021-02-17,Nintendo Switch,nintendo switch,e682, $168.00 ,website,direct,direct,desktop,desktop,US,TRUE,NA,168.0
55e4e59a,da3a1a1afe837758,14-02-2021,2021-02-14,2021,2,2,2021-02-16,Acer Nitro V Gaming Laptop,acer nitro v gaming laptop,22ea, $873.58 ,website,direct,direct,desktop,desktop,GB,TRUE,EMEA,873.58
4d302cc3,d4e5128d08334291,14-02-2021,2021-02-14,2021,2,2,2021-02-16,Nintendo Switch,nintendo switch,e682, $153.59 ,website,direct,direct,desktop,desktop,AU,TRUE,EMEA,153.59
beadff41,d123bf0bba780732,14-02-2021,2021-02-14,2021,2,2,2021-02-16,Nintendo Switch,nintendo switch,8d0d, $164.88 ,website,direct,direct,desktop,desktop,ES,TRUE,EMEA,164.88
2277e6e0,c841e08be5016984,14-02-2021,2021-02-14,2021,2,2,2021-02-16,Nintendo Switch,nintendo switch,8d0d, $184.90 ,website,direct,direct,desktop,desktop,GB,TRUE,EMEA,184.9
8b817f8d,c82c61c28ab59262,14-02-2021,2021-02-14,2021,2,1,2021-02-15,27in 4K gaming monitor,27in 4k gaming monitor,e7e6, $480.00 ,website,email,email,desktop,desktop,US,TRUE,NA,480.0
b0f9e63a,c7edbb602a775011,14-02-2021,2021-02-14,2021,2,3,2021-02-17,Sony PlayStation 5 Bundle,sony playstation 5 bundle,54ed," $1,530.00 ",website,direct,direct,desktop,desktop,US,TRUE,NA,1530.0
4153f050,c7d1700953329521,14-02-2021,2021-02-14,2021,2,3,2021-02-17,Nintendo Switch,nintendo switch,e682, $168.00 ,website,direct,direct,desktop,desktop,US,TRUE,NA,168.0
f440a87a,c7164513ae2103242,14-02-2021,2021-02-14,2021,2,1,2021-02-15,Nintendo Switch,nintendo switch,e682, $164.88 ,website,email,email,desktop,desktop,ES,TRUE,EMEA,164.88
539eb1e5,c4c8e713c0236856,14-02-2021,2021-02-14,2021,2,2,2021-02-16,27in 4K gaming monitor,27in 4k gaming monitor,e7e6, $480.00 ,website,direct,direct,desktop,desktop,US,TRUE,NA,480.0
46a0d70f,bb484fddc3a31626,14-02-2021,2021-02-14,2021,2,1,2021-02-15,27in 4K gaming monitor,27in 4k gaming monitor,e7e6, $480.00 ,website,affiliate,affiliate,unknown,unknown,US,TRUE,NA,480.0
b8d27dd2,ff6b7961ce578289,13-02-2021,2021-02-13,2021,2,1,2021-02-14,Dell Gaming Mouse,dell gaming mouse,8d4f, $62.45 ,mobile app,direct,direct,desktop,desktop,AU,TRUE,EMEA,62.45
6142b082,ff2b0c72bc142289,13-02-2021,2021-02-13,2021,2,2,2021-02-15,Dell Gaming Mouse,dell gaming mouse,8d4f, $51.03 ,mobile app,direct,direct,desktop,desktop,CA,TRUE,EMEA,51.03
ad8c290d,e4b47f64f5673539,13-02-2021,2021-02-13,2021,2,2,2021-02-15,JBL Quantum 100 Gaming Headset,jbl quantum 100 gaming headset,4c58, $19.14 ,mobile app,direct,direct,desktop,desktop,GB,TRUE,EMEA,19.14
1d7b9895,e419cfd1a4315084,13-02-2021,2021-02-13,2021,2,2,2021-02-15,Dell Gaming Mouse,dell gaming mouse,8d4f, $49.98 ,mobile app,email,email,desktop,desktop,US,TRUE,NA,49.98
aaceb13c,dabba621d4b72429,13-02-2021,2021-02-13,2021,2,3,2021-02-16,JBL Quantum 100 Gaming Headset,jbl quantum 100 gaming headset,4db1, $14.09 ,mobile app,direct,direct,desktop,desktop,AU,TRUE,EMEA,14.09
25926e2c,da96ff1661e18192,13-02-2021,2021-02-13,2021,2,1,2021-02-14,Dell Gaming Mouse,dell gaming mouse,8d4f, $66.78 ,mobile app,direct,direct,desktop,desktop,GB,TRUE,EMEA,66.78
1f9335d9,d0bf5238dc015927,13-02-2021,2021-02-13,2021,2,3,2021-02-16,JBL Quantum 100 Gaming Headset,jbl quantum 100 gaming headset,4c58, $28.65 ,mobile app,direct,direct,desktop,desktop,AT,TRUE,EMEA,28.65
c5d242d1,ce507325d3683704,13-02-2021,2021-02-13,2021,2,2,2021-02-15,Dell Gaming Mouse,dell gaming mouse,f81e, $49.98 ,mobile app,email,email,desktop,desktop,US,TRUE,NA,49.98
ad1213a7,c742aa3464673323,13-02-2021,2021-02-13,2021,2,1,2021-02-14,JBL Quantum 100 Gaming Headset,jbl quantum 100 gaming headset,4db1, $24.55 ,mobile app,email,email,desktop,desktop,GB,TRUE,EMEA,24.55
44276c8f,febb43270e430665,13-02-2021,2021-02-13,2021,2,1,2021-02-14,27in 4K gaming monitor,27in 4k gaming monitor,e7e6, $451.63 ,website,email,email,desktop,desktop,FR,TRUE,EMEA,451.63
5a8b90ec,fdbaf08293639583,13-02-2021,2021-02-13,2021,2,3,2021-02-16,Nintendo Switch,nintendo switch,e682, $168.00 ,website,affiliate,affiliate,unknown,unknown,US,TRUE,NA,168.0
8b96758,fdbaf08293639583,13-02-2021,2021-02-13,2021,2,3,2021-02-16,Nintendo Switch,nintendo switch,e682, $168.00 ,website,affiliate,affiliate,unknown,unknown,US,TRUE,NA,168.0
59deca1d,fce09c874ea39274,13-02-2021,2021-02-13,2021,2,3,2021-02-16,Lenovo IdeaPad Gaming 3,lenovo ideapad gaming 3,9ef0," $1,129.80 ",website,direct,direct,desktop,desktop,EE,TRUE,EMEA,1129.8
a9302c87,f6bd132828e71704,13-02-2021,2021-02-13,2021,2,1,2021-02-14,Nintendo Switch,nintendo switch,e682, $49.05 ,website,direct,direct,desktop,desktop,TR,TRUE,EMEA,49.05
3029632,f6bd132828e71704,13-02-2021,2021-02-13,2021,2,1,2021-02-14,Nintendo Switch,nintendo switch,e682, $49.05 ,website,direct,direct,desktop,desktop,TR,TRUE,EMEA,49.05
3ebbbe08,efc1b78537428435,13-02-2021,2021-02-13,2021,2,1,2021-02-14,Lenovo IdeaPad Gaming 3,lenovo ideapad gaming 3,04ac," $1,289.65 ",website,direct,direct,desktop,desktop,GB,TRUE,EMEA,1289.65
6c532e0e,eebaa96b93746756,13-02-2021,2021-02-13,2021,2,1,2021-02-14,Acer Nitro V Gaming Laptop,acer nitro v gaming laptop,22ea, $798.00 ,website,direct,direct,desktop,desktop,US,TRUE,NA,798.0
ede41cf3,ee59a134829100481,13-02-2021,2021-02-13,2021,2,3,2021-02-16,27in 4K gaming monitor,27in 4k gaming monitor,e7e6, $480.00 ,website,direct,direct,desktop,desktop,US,TRUE,NA,480.0
dad31204,ed23f9aed5e92461,13-02-2021,2021-02-13,2021,2,3,2021-02-16,Nintendo Switch,nintendo switch,e682, $157.73 ,website,direct,direct,desktop,desktop,KR,TRUE,APAC,157.73
d315349,ed23f9aed5e92461,13-02-2021,2021-02-13,2021,2,3,2021-02-16,Nintendo Switch,nintendo switch,e682, $157.73 ,website,direct,direct,desktop,desktop,KR,TRUE,APAC,157.73
da6f0542,ea20cba734d92278,13-02-2021,2021-02-13,2021,2,3,2021-02-16,Nintendo Switch,nintendo switch,e682, $168.00 ,website,direct,direct,desktop,desktop,US,TRUE,NA,168.0
6f08296,ea20cba734d92278,13-02-2021,2021-02-13,2021,2,3,2021-02-16,Nintendo Switch,nintendo switch,e682, $168.00 ,website,direct,direct,desktop,desktop,US,TRUE,NA,168.0
5a318062,e65b8d3875e39410,13-02-2021,2021-02-13,2021,2,1,2021-02-14,27in 4K gaming monitor,27in 4k gaming monitor,891b, $383.03 ,website,direct,direct,desktop,desktop,JP,TRUE,APAC,383.03
6d65576f,e05adeb2d9f47215,13-02-2021,2021-02-13,2021,2,2,2021-02-15,27in 4K gaming monitor,27in 4k gaming monitor,891b, $384.00 ,website,direct,direct,desktop,desktop,NZ,TRUE,APAC,384.0
62df4188,dd149fb72ec42862,13-02-2021,2021-02-13,2021,2,2,2021-02-15,Nintendo Switch,nintendo switch,8d0d, $126.00 ,website,direct,direct,desktop,desktop,US,TRUE,NA,126.0
e4188f44,da62bd08e4f96342,13-02-2021,2021-02-13,2021,2,3,2021-02-16,Nintendo Switch,nintendo switch,e682, $156.24 ,website,email,email,desktop,desktop,CA,TRUE,EMEA,156.24
646c8970,d49acd75a5543449,13-02-2021,2021-02-13,2021,2,3,2021-02-16,Nintendo Switch,nintendo switch,e682, $168.00 ,website,direct,direct,desktop,desktop,US,TRUE,NA,168.0
eec0c6e6,d2697417ca4100850,13-02-2021,2021-02-13,2021,2,3,2021-02-16,Nintendo Switch,nintendo switch,e682, $168.00 ,website,direct,direct,desktop,desktop,US,TRUE,NA,168.0
c2ebd495,d2042deeb9982544,13-02-2021,2021-02-13,2021,2,1,2021-02-14,Nintendo Switch,nintendo switch,e682, $158.32 ,website,direct,direct,desktop,desktop,CA,TRUE,EMEA,158.32
3c926c43,cecf9b4542727534,13-02-2021,2021-02-13,2021,2,1,2021-02-14,Nintendo Switch,nintendo switch,e682, $162.75 ,website,direct,direct,desktop,desktop,FR,TRUE,EMEA,162.75
4ace0d9d,cc31a53b42833257,13-02-2021,2021-02-13,2021,2,1,2021-02-14,Nintendo Switch,nintendo switch,e682, $164.69 ,website,direct,direct,desktop,desktop,NL,TRUE,EMEA,164.69
c0ca1179,cb4c273cf3b81644,13-02-2021,2021-02-13,2021,2,3,2021-02-16,Nintendo Switch,nintendo switch,8d0d, $162.75 ,website,direct,direct,desktop,desktop,GR,TRUE,EMEA,162.75
4082f70e,cafeab3525d29182,13-02-2021,2021-02-13,2021,2,2,2021-02-15,JBL Quantum 100 Gaming Headset,jbl quantum 100 gaming headset,ab0f, $24.00 ,website,direct,direct,desktop,desktop,US,TRUE,NA,24.0
af8f63fa,cae08c1a53174396,13-02-2021,2021-02-13,2021,2,1,2021-02-14,Lenovo IdeaPad Gaming 3,lenovo ideapad gaming 3,9ef0," $1,198.00 ",website,direct,direct,desktop,desktop,US,TRUE,NA,1198.0
e53f0eb1,c92d9d3f5fd96839,13-02-2021,2021-02-13,2021,2,3,2021-02-16,Sony PlayStation 5 Bundle,sony playstation 5 bundle,54ed," $1,800.00 ",website,direct,direct,desktop,desktop,US,TRUE,NA,1800.0
81c0486c,c53623d2bb555333,13-02-2021,2021-02-13,2021,2,1,2021-02-14,JBL Quantum 100 Gaming Headset,jbl quantum 100 gaming headset,ab0f, $20.15 ,website,direct,direct,desktop,desktop,CA,TRUE,EMEA,20.15
5774227a,c36fc9a568838351,13-02-2021,2021-02-13,2021,2,1,2021-02-14,Nintendo Switch,nintendo switch,8d0d, $184.90 ,website,direct,direct,desktop,desktop,GB,TRUE,EMEA,184.9
9ad46a57,bee89aa173a65477,13-02-2021,2021-02-13,2021,2,3,2021-02-16,27in 4K gaming monitor,27in 4k gaming monitor,e7e6, $451.63 ,website,social media,social media,tablet,tablet,IE,TRUE,EMEA,451.63
dd047f3a,bd59021e2e493382,13-02-2021,2021-02-13,2021,2,2,2021-02-15,Nintendo Switch,nintendo switch,8d0d, $168.00 ,website,direct,direct,desktop,desktop,PE,TRUE,LATAM,168.0
83e655b4,bb6b6e326b856137,13-02-2021,2021-02-13,2021,2,3,2021-02-16,Sony PlayStation 5 Bundle,sony playstation 5 bundle,54ed," $1,530.00 ",website,direct,direct,desktop,desktop,US,TRUE,NA,1530.0
fd0586b7,b7fe3a52b7f106869,13-02-2021,2021-02-13,2021,2,3,2021-02-16,JBL Quantum 100 Gaming Headset,jbl quantum 100 gaming headset,ab0f, $24.00 ,website,direct,direct,desktop,desktop,US,TRUE,NA,24.0
41492fbf,f26930654ec29504,12-02-2021,2021-02-12,2021,2,3,2021-02-15,Dell Gaming Mouse,dell gaming mouse,8d4f, $48.85 ,mobile app,direct,direct,desktop,desktop,MX,TRUE,LATAM,48.85
140dc528,ddc9cb00aee11197,12-02-2021,2021-02-12,2021,2,1,2021-02-13,JBL Quantum 100 Gaming Headset,jbl quantum 100 gaming headset,4db1, $14.19 ,mobile app,direct,direct,desktop,desktop,PK,TRUE,APAC,14.19
43334030,ee58e6c2e791136,12-02-2021,2021-02-12,2021,2,3,2021-02-15,Nintendo Switch,nintendo switch,8d0d, $168.00 ,website,direct,direct,desktop,desktop,US,TRUE,NA,168.0
3343230,ee58e6c2e791136,12-02-2021,2021-02-12,2021,2,3,2021-02-15,Nintendo Switch,nintendo switch,8d0d, $168.00 ,website,direct,direct,desktop,desktop,US,TRUE,NA,168.0
1511d27e,e8cc55cca9311608,12-02-2021,2021-02-12,2021,2,1,2021-02-13,Nintendo Switch,nintendo switch,e682, $188.15 ,website,direct,direct,desktop,desktop,GB,TRUE,EMEA,188.15
11d9372,e8cc55cca9311608,12-02-2021,2021-02-12,2021,2,1,2021-02-13,Nintendo Switch,nintendo switch,e682, $188.15 ,website,direct,direct,desktop,desktop,GB,TRUE,EMEA,188.15
5aea36bf,e5e5fe041fa39744,12-02-2021,2021-02-12,2021,2,2,2021-02-14,27in 4K gaming monitor,27in 4k gaming monitor,891b, $314.24 ,website,affiliate,affiliate,unknown,unknown,DE,TRUE,EMEA,314.24
3bfce16c,e3a3e86108327299,12-02-2021,2021-02-12,2021,2,3,2021-02-15,27in 4K gaming monitor,27in 4k gaming monitor,e7e6, $450.62 ,website,direct,direct,desktop,desktop,JP,TRUE,APAC,450.62
cbdc54e5,e213d4d00a386143,12-02-2021,2021-02-12,2021,2,2,2021-02-14,Nintendo Switch,nintendo switch,e682, $188.96 ,website,direct,direct,desktop,desktop,GB,TRUE,EMEA,188.96
75c6bee5,df39b4bf2d850486,12-02-2021,2021-02-12,2021,2,2,2021-02-14,27in 4K gaming monitor,27in 4k gaming monitor,891b, $378.82 ,website,direct,direct,desktop,desktop,US,TRUE,NA,378.82
82290ec5,de6fb8eb59a55492,12-02-2021,2021-02-12,2021,2,3,2021-02-15,Nintendo Switch,nintendo switch,8d0d, $168.00 ,website,direct,direct,desktop,desktop,HK,TRUE,EMEA,168.0
f5be0151,db695693bf4103832,12-02-2021,2021-02-12,2021,2,2,2021-02-14,JBL Quantum 100 Gaming Headset,jbl quantum 100 gaming headset,ab0f, $23.87 ,website,direct,direct,desktop,desktop,ES,TRUE,EMEA,23.87
0986ff1b,d53f16fc8176913,12-02-2021,2021-02-12,2021,2,3,2021-02-15,27in 4K gaming monitor,27in 4k gaming monitor,e7e6, $480.00 ,website,email,email,desktop,desktop,US,TRUE,NA,480.0
f051872c,d490cd27431101589,12-02-2021,2021-02-12,2021,2,3,2021-02-15,27in 4K gaming monitor,27in 4k gaming monitor,891b, $310.16 ,website,direct,direct,desktop,desktop,US,TRUE,NA,310.16
faf1d519,cf5f72b9f7f106028,12-02-2021,2021-02-12,2021,2,2,2021-02-14,Nintendo Switch,nintendo switch,8d0d, $162.75 ,website,affiliate,affiliate,unknown,unknown,IT,TRUE,EMEA,162.75
97d7087b,cec754d967964288,12-02-2021,2021-02-12,2021,2,2,2021-02-14,Nintendo Switch,nintendo switch,e682, $154.75 ,website,direct,direct,desktop,desktop,CA,TRUE,EMEA,154.75
41fd7bd4,c486b72998f29779,12-02-2021,2021-02-12,2021,2,1,2021-02-13,Nintendo Switch,nintendo switch,e682, $168.00 ,website,direct,direct,desktop,desktop,US,TRUE,NA,168.0
de7dbe5f,c3ebf29885b94024,12-02-2021,2021-02-12,2021,2,1,2021-02-13,27in 4K gaming monitor,27in 4k gaming monitor,891b, $454.02 ,website,direct,direct,desktop,desktop,GB,TRUE,EMEA,454.02
19297449,b9eb303d0bf539,12-02-2021,2021-02-12,2021,2,3,2021-02-15,Nintendo Switch,nintendo switch,e682, $168.00 ,website,direct,direct,desktop,desktop,US,TRUE,NA,168.0
489bd8de,b773ea05af232402,12-02-2021,2021-02-12,2021,2,2,2021-02-14,27in 4K gaming monitor,27in 4k gaming monitor,891b, $415.63 ,website,affiliate,affiliate,unknown,unknown,DK,TRUE,EMEA,415.63
02e48a7a,b6f44d2d8074372,12-02-2021,2021-02-12,2021,2,3,2021-02-15,Nintendo Switch,nintendo switch,e682, $168.00 ,website,direct,direct,desktop,desktop,US,TRUE,NA,168.0
78009722,f411d77d3642057,11-02-2021,2021-02-11,2021,2,2,2021-02-13,JBL Quantum 100 Gaming Headset,jbl quantum 100 gaming headset,8315, $23.52 ,mobile app,direct,direct,desktop,desktop,NAN,TRUE,unknown,23.52
f5d2ff28,f0fdb4247cf103868,11-02-2021,2021-02-11,2021,2,1,2021-02-12,JBL Quantum 100 Gaming Headset,jbl quantum 100 gaming headset,4c58, $16.49 ,mobile app,direct,direct,desktop,desktop,IE,TRUE,EMEA,16.49
7b8d0614,d6464d019e952798,11-02-2021,2021-02-11,2021,2,3,2021-02-14,JBL Quantum 100 Gaming Headset,jbl quantum 100 gaming headset,4c58, $13.98 ,mobile app,direct,direct,desktop,desktop,US,TRUE,NA,13.98
cd663d71,d253880a28386765,11-02-2021,2021-02-11,2021,2,3,2021-02-14,JBL Quantum 100 Gaming Headset,jbl quantum 100 gaming headset,8315, $23.60 ,mobile app,email,email,desktop,desktop,US,TRUE,NA,23.6
c127259a,ca7b374659c81788,11-02-2021,2021-02-11,2021,2,1,2021-02-12,Dell Gaming Mouse,dell gaming mouse,8d4f, $49.98 ,mobile app,direct,direct,desktop,desktop,US,TRUE,NA,49.98
f0754f63,bf1eb29bf3e101653,11-02-2021,2021-02-11,2021,2,2,2021-02-13,Dell Gaming Mouse,dell gaming mouse,f81e, $50.92 ,mobile app,email,email,desktop,desktop,EG,TRUE,EMEA,50.92
db04839a,f888cc34b3b92551,11-02-2021,2021-02-11,2021,2,3,2021-02-14,Nintendo Switch,nintendo switch,e682, $158.32 ,website,direct,direct,desktop,desktop,CA,TRUE,EMEA,158.32
0487470,f888cc34b3b92551,11-02-2021,2021-02-11,2021,2,3,2021-02-14,Nintendo Switch,nintendo switch,e682, $158.32 ,website,direct,direct,desktop,desktop,CA,TRUE,EMEA,158.32
f846a37b,f5a2e73ede1104889,11-02-2021,2021-02-11,2021,2,1,2021-02-12,27in 4K gaming monitor,27in 4k gaming monitor,891b, $382.96 ,website,direct,direct,desktop,desktop,FI,TRUE,EMEA,382.96
774c7f4c,f5955617ec351094,11-02-2021,2021-02-11,2021,2,3,2021-02-14,JBL Quantum 100 Gaming Headset,jbl quantum 100 gaming headset,ab0f, $17.98 ,website,direct,direct,desktop,desktop,PL,TRUE,EMEA,17.98
ccc2e57d,f404ef0cf9f86493,11-02-2021,2021-02-11,2021,2,1,2021-02-12,Nintendo Switch,nintendo switch,e682, $168.00 ,website,direct,direct,desktop,desktop,US,TRUE,NA,168.0
c2e2765,f404ef0cf9f86493,11-02-2021,2021-02-11,2021,2,1,2021-02-12,Nintendo Switch,nintendo switch,e682, $168.00 ,website,direct,direct,desktop,desktop,US,TRUE,NA,168.0
e94149c7,f00bbdd021b98531,11-02-2021,2021-02-11,2021,2,3,2021-02-14,JBL Quantum 100 Gaming Headset,jbl quantum 100 gaming headset,ab0f, $24.00 ,website,direct,direct,desktop,desktop,US,TRUE,NA,24.0
d561a4fd,ef5390b5c3e90067,11-02-2021,2021-02-11,2021,2,1,2021-02-12,Nintendo Switch,nintendo switch,e682, $150.92 ,website,direct,direct,desktop,desktop,RU,TRUE,APAC,150.92
61a1650,ef5390b5c3e90067,11-02-2021,2021-02-11,2021,2,1,2021-02-12,Nintendo Switch,nintendo switch,e682, $150.92 ,website,direct,direct,desktop,desktop,RU,TRUE,APAC,150.92
8e39cf63,ee215f894a260392,11-02-2021,2021-02-11,2021,2,3,2021-02-14,Nintendo Switch,nintendo switch,e682, $156.24 ,website,direct,direct,desktop,desktop,CA,TRUE,EMEA,156.24
39c9481,ee215f894a260392,11-02-2021,2021-02-11,2021,2,3,2021-02-14,Nintendo Switch,nintendo switch,e682, $156.24 ,website,direct,direct,desktop,desktop,CA,TRUE,EMEA,156.24
032a0d37,edfcea07fb74452,11-02-2021,2021-02-11,2021,2,1,2021-02-12,Nintendo Switch,nintendo switch,e682, $168.00 ,website,direct,direct,desktop,desktop,US,TRUE,NA,168.0
2a05399,edfcea07fb74452,11-02-2021,2021-02-11,2021,2,1,2021-02-12,Nintendo Switch,nintendo switch,e682, $168.00 ,website,direct,direct,desktop,desktop,US,TRUE,NA,168.0
14929ddd,ece866d9e3b11413,11-02-2021,2021-02-11,2021,2,3,2021-02-14,Nintendo Switch,nintendo switch,e682, $188.96 ,website,direct,direct,desktop,desktop,GB,TRUE,EMEA,188.96
9297634,ece866d9e3b11413,11-02-2021,2021-02-11,2021,2,3,2021-02-14,Nintendo Switch,nintendo switch,e682, $188.96 ,website,direct,direct,desktop,desktop,GB,TRUE,EMEA,188.96
a7c545e4,e6ef83e624f71059,11-02-2021,2021-02-11,2021,2,2,2021-02-13,Nintendo Switch,nintendo switch,e682, $168.00 ,website,direct,direct,desktop,desktop,US,TRUE,NA,168.0
c543981,e6ef83e624f71059,11-02-2021,2021-02-11,2021,2,2,2021-02-13,Nintendo Switch,nintendo switch,e682, $168.00 ,website,direct,direct,desktop,desktop,US,TRUE,NA,168.0
ea8e0c93,e554b7155a499091,11-02-2021,2021-02-11,2021,2,1,2021-02-12,27in 4K gaming monitor,27in 4k gaming monitor,891b, $379.66 ,website,direct,direct,desktop,desktop,IL,TRUE,EMEA,379.66
bdb3e396,e1467157fee80300,11-02-2021,2021-02-11,2021,2,2,2021-02-13,27in 4K gaming monitor,27in 4k gaming monitor,891b, $305.33 ,website,email,email,desktop,desktop,IT,TRUE,EMEA,305.33
cc428088,ddd5841c7ce86289,11-02-2021,2021-02-11,2021,2,2,2021-02-13,Nintendo Switch,nintendo switch,8d0d, $117.18 ,website,direct,direct,desktop,desktop,CA,TRUE,EMEA,117.18
ed905381,dce3c2a8463100362,11-02-2021,2021-02-11,2021,2,3,2021-02-14,Sony PlayStation 5 Bundle,sony playstation 5 bundle,54ed," $2,004.90 ",website,email,email,desktop,desktop,DE,TRUE,EMEA,2004.9
2870dfe7,dbe73793d7519356,11-02-2021,2021-02-11,2021,2,2,2021-02-13,27in 4K gaming monitor,27in 4k gaming monitor,e7e6, $480.00 ,website,email,email,desktop,desktop,US,TRUE,NA,480.0
c446a628,d7d8ea114fd83106,11-02-2021,2021-02-11,2021,2,2,2021-02-13,27in 4K gaming monitor,27in 4k gaming monitor,891b, $408.66 ,website,direct,direct,desktop,desktop,BR,TRUE,EMEA,408.66
ebbbf4ad,d7d60ed7bf399581,11-02-2021,2021-02-11,2021,2,3,2021-02-14,JBL Quantum 100 Gaming Headset,jbl quantum 100 gaming headset,ab0f, $24.00 ,website,direct,direct,desktop,desktop,US,TRUE,NA,24.0
eab7b06a,d45e32590fb99164,11-02-2021,2021-02-11,2021,2,1,2021-02-12,Lenovo IdeaPad Gaming 3,lenovo ideapad gaming 3,04ac," $1,018.30 ",website,direct,direct,desktop,desktop,US,TRUE,NA,1018.3
c70dc8fb,d148bbbcb9384188,11-02-2021,2021-02-11,2021,2,2,2021-02-13,Nintendo Switch,nintendo switch,8d0d, $152.06 ,website,direct,direct,desktop,desktop,CH,TRUE,EMEA,152.06
1946ebd9,cf02c11c18b13257,11-02-2021,2021-02-11,2021,2,3,2021-02-14,Nintendo Switch,nintendo switch,e682, $188.15 ,website,unknown,unknown,unknown,unknown,GB,TRUE,EMEA,188.15
bfb1faff,c591e57c34c81166,11-02-2021,2021-02-11,2021,2,3,2021-02-14,Nintendo Switch,nintendo switch,e682, $188.15 ,website,direct,direct,desktop,desktop,GB,TRUE,EMEA,188.15
e2846423,c56b647970695697,11-02-2021,2021-02-11,2021,2,1,2021-02-12,Nintendo Switch,nintendo switch,e682, $168.00 ,website,direct,direct,desktop,desktop,US,TRUE,NA,168.0
a0d082b3,bf3535c968f68026,11-02-2021,2021-02-11,2021,2,3,2021-02-14,Nintendo Switch,nintendo switch,e682, $153.88 ,website,direct,direct,desktop,desktop,AU,TRUE,EMEA,153.88
dededf4e,bd068bfbb6694203,11-02-2021,2021-02-11,2021,2,1,2021-02-12,27in 4K gaming monitor,27in 4k gaming monitor,891b, $480.00 ,website,direct,direct,desktop,desktop,BR,TRUE,EMEA,480.0
70983a85,b96ac13ce4748497,11-02-2021,2021-02-11,2021,2,2,2021-02-13,Nintendo Switch,nintendo switch,e682, $168.00 ,website,unknown,unknown,tv,tv,US,TRUE,NA,168.0
4371c76a,b682b0c6cfe30365,11-02-2021,2021-02-11,2021,2,1,2021-02-12,Nintendo Switch,nintendo switch,e682, $168.00 ,website,direct,direct,desktop,desktop,CL,TRUE,EMEA,168.0
754e705d,f5f247088c250317,10-02-2021,2021-02-10,2021,2,2,2021-02-12,JBL Quantum 100 Gaming Headset,jbl quantum 100 gaming headset,4c58, $13.98 ,mobile app,direct,direct,desktop,desktop,US,TRUE,NA,13.98
2677e53a,ec3f6db609c18571,10-02-2021,2021-02-10,2021,2,1,2021-02-11,Dell Gaming Mouse,dell gaming mouse,8d4f, $49.98 ,mobile app,direct,direct,desktop,desktop,US,TRUE,NA,49.98
c8939061,bc85d25d6c584817,10-02-2021,2021-02-10,2021,2,3,2021-02-13,Dell Gaming Mouse,dell gaming mouse,8d4f, $49.98 ,mobile app,direct,direct,desktop,desktop,US,TRUE,NA,49.98
1d8f3137,fa68c4e8ba915122,10-02-2021,2021-02-10,2021,2,1,2021-02-11,Nintendo Switch,nintendo switch,e682, $168.00 ,website,direct,direct,desktop,desktop,US,TRUE,NA,168.0
8f38949,fa68c4e8ba915122,10-02-2021,2021-02-10,2021,2,1,2021-02-11,Nintendo Switch,nintendo switch,e682, $168.00 ,website,direct,direct,desktop,desktop,US,TRUE,NA,168.0
8.3493E+22,f3be27c6c3c2833,10-02-2021,2021-02-10,2021,2,2,2021-02-12,27in 4K gaming monitor,27in 4k gaming monitor,891b, $480.00 ,website,direct,direct,desktop,desktop,BR,TRUE,EMEA,480.0
aee1e160,f343a3756c474119,10-02-2021,2021-02-10,2021,2,3,2021-02-13,Nintendo Switch,nintendo switch,e682, $168.00 ,website,direct,direct,desktop,desktop,US,TRUE,NA,168.0
e1e7437,f343a3756c474119,10-02-2021,2021-02-10,2021,2,3,2021-02-13,Nintendo Switch,nintendo switch,e682, $168.00 ,website,direct,direct,desktop,desktop,US,TRUE,NA,168.0
eefa6603,e71fe9bf132100959,10-02-2021,2021-02-10,2021,2,2,2021-02-12,JBL Quantum 100 Gaming Headset,jbl quantum 100 gaming headset,ab0f, $23.87 ,website,direct,direct,desktop,desktop,FR,TRUE,EMEA,23.87
d399e938,e50a8bb713289334,10-02-2021,2021-02-10,2021,2,1,2021-02-11,Nintendo Switch,nintendo switch,e682, $178.40 ,website,direct,direct,desktop,desktop,TW,TRUE,APAC,178.4
.99E45,e50a8bb713289334,10-02-2021,2021-02-10,2021,2,1,2021-02-11,Nintendo Switch,nintendo switch,e682, $178.40 ,website,direct,direct,desktop,desktop,TW,TRUE,APAC,178.4
52e2062d,e44ebe4eed936564,10-02-2021,2021-02-10,2021,2,1,2021-02-11,Nintendo Switch,nintendo switch,e682, $102.88 ,website,direct,direct,desktop,desktop,MX,TRUE,LATAM,102.88
7d98183,e44ebe4eed936564,10-02-2021,2021-02-10,2021,2,1,2021-02-11,Nintendo Switch,nintendo switch,e682, $102.88 ,website,direct,direct,desktop,desktop,MX,TRUE,LATAM,102.88
be51aa15,e36f41c215180561,10-02-2021,2021-02-10,2021,2,2,2021-02-12,Nintendo Switch,nintendo switch,e682, $168.00 ,website,direct,direct,desktop,desktop,US,TRUE,NA,168.0
ef3287ce,e1e74d639ce101054,10-02-2021,2021-02-10,2021,2,3,2021-02-13,Lenovo IdeaPad Gaming 3,lenovo ideapad gaming 3,04ac, $914.62 ,website,direct,direct,desktop,desktop,AT,TRUE,EMEA,914.62
